"DESCRIPTION","DURATION IN MS","NAME","PARENT SUITE","START TIME","STATUS","STOP TIME","SUB SUITE","SUITE","TEST CLASS","TEST METHOD"
"Test cases for TestHeaderMatches","0","TestHeaderMatches","","Fri Mar 27 01:54:06 UTC 2026","passed","Fri Mar 27 01:54:06 UTC 2026","","Go Test","github.com/specterops/bloodhound/cmd/api/src/utils/TestHeaderMatches","TestHeaderMatches"
"","198","should handle close event","TagToZoneLabelDialog","Fri Mar 27 01:57:19 UTC 2026","passed","Fri Mar 27 01:57:19 UTC 2026","","","",""
"","62","returns false on 404","useGraphHasData","Fri Mar 27 01:58:47 UTC 2026","passed","Fri Mar 27 01:58:47 UTC 2026","","","",""
"Test cases for TestContextMiddlewareBypassEnabled","0","TestContextMiddlewareBypassEnabled","","Fri Mar 27 01:53:40 UTC 2026","passed","Fri Mar 27 01:53:40 UTC 2026","","Go Test","github.com/specterops/bloodhound/cmd/api/src/api/middleware/TestContextMiddlewareBypassEnabled","TestContextMiddlewareBypassEnabled"
"","0","handles specific Active Directory properties differently than Azure derived properties","Formatting number properties","Fri Mar 27 01:55:52 UTC 2026","passed","Fri Mar 27 01:55:52 UTC 2026","","","",""
"Test cases for TestIntPointer","0","TestIntPointer","","Fri Mar 27 01:53:49 UTC 2026","passed","Fri Mar 27 01:53:49 UTC 2026","","Go Test","github.com/specterops/bloodhound/cmd/api/src/database/types/null/TestIntPointer","TestIntPointer"
"Test cases for TestManagementResource_GetRole","31453","TestManagementResource_GetRole","","Fri Mar 27 01:53:53 UTC 2026","passed","Fri Mar 27 01:54:25 UTC 2026","","Go Test","github.com/specterops/bloodhound/cmd/api/src/api/v2/auth/TestManagementResource_GetRole","TestManagementResource_GetRole"
"Test cases for TestReadRFC3339","0","TestReadRFC3339","","Fri Mar 27 01:54:06 UTC 2026","passed","Fri Mar 27 01:54:06 UTC 2026","","Go Test","github.com/specterops/bloodhound/cmd/api/src/utils/TestReadRFC3339","TestReadRFC3339"
"Test cases for TestInt64Equal","0","TestInt64Equal","","Fri Mar 27 01:53:49 UTC 2026","passed","Fri Mar 27 01:53:49 UTC 2026","","Go Test","github.com/specterops/bloodhound/cmd/api/src/database/types/null/TestInt64Equal","TestInt64Equal"
"","52","links to the specified route with global params intact when triggered by a splat route","AppLink","Fri Mar 27 01:57:36 UTC 2026","passed","Fri Mar 27 01:57:36 UTC 2026","","","",""
"Test cases for TestResources_ListADEntityPSRemoteRights","0","TestResources_ListADEntityPSRemoteRights","","Fri Mar 27 01:53:47 UTC 2026","passed","Fri Mar 27 01:53:47 UTC 2026","","Go Test","github.com/specterops/bloodhound/cmd/api/src/api/v2/TestResources_ListADEntityPSRemoteRights","TestResources_ListADEntityPSRemoteRights"
"","1","filters by high risk level","filterAndSearchEnvironments","Fri Mar 27 01:55:00 UTC 2026","passed","Fri Mar 27 01:55:00 UTC 2026","","risk filters","",""
"Test cases for TestMarshalTime","0","TestMarshalTime","","Fri Mar 27 01:53:49 UTC 2026","passed","Fri Mar 27 01:53:49 UTC 2026","","Go Test","github.com/specterops/bloodhound/cmd/api/src/database/types/null/TestMarshalTime","TestMarshalTime"
"","3","should return null if the edge key does not have enough information","getEdgeDataFromKey","Fri Mar 27 02:00:26 UTC 2026","passed","Fri Mar 27 02:00:26 UTC 2026","","","",""
"","80","fails checks if the user does not have a matching permission","usePermissions","Fri Mar 27 01:56:02 UTC 2026","passed","Fri Mar 27 01:56:02 UTC 2026","","","",""
"","10","does not include OpenGraph edges when the associated feature flag is disabled","useEdgeCategories","Fri Mar 27 01:56:01 UTC 2026","passed","Fri Mar 27 01:56:01 UTC 2026","","","",""
"","0","returns null if paramValue is undefined","useEnvironmentParams","Fri Mar 27 01:59:19 UTC 2026","passed","Fri Mar 27 01:59:19 UTC 2026","","parseEnvironmentAggregation","",""
"","2","prevents Sigma defaults events","preventAllDefaults","Fri Mar 27 02:00:30 UTC 2026","passed","Fri Mar 27 02:00:30 UTC 2026","","","",""
"Test cases for TestRoleAssignments_UsersWithoutRoles","0","TestRoleAssignments_UsersWithoutRoles","","Fri Mar 27 01:54:07 UTC 2026","passed","Fri Mar 27 01:54:07 UTC 2026","","Go Test","github.com/specterops/bloodhound/packages/go/analysis/azure/TestRoleAssignments_UsersWithoutRoles","TestRoleAssignments_UsersWithoutRoles"
"","141","renders the glyph form input when the editing a zone that is not the highest privileged","Tag Form","Fri Mar 27 01:54:48 UTC 2026","passed","Fri Mar 27 01:54:48 UTC 2026","","","",""
"Test cases for TestBuildErrorResponseConflict","0","TestBuildErrorResponseConflict","","Fri Mar 27 01:53:37 UTC 2026","passed","Fri Mar 27 01:53:37 UTC 2026","","Go Test","github.com/specterops/bloodhound/cmd/api/src/api/TestBuildErrorResponseConflict","TestBuildErrorResponseConflict"
"Test cases for TestQueries_BuildEntityQueryParams_MissingObjectID","0","TestQueries_BuildEntityQueryParams_MissingObjectID","","Fri Mar 27 01:53:51 UTC 2026","passed","Fri Mar 27 01:53:51 UTC 2026","","Go Test","github.com/specterops/bloodhound/cmd/api/src/queries/TestQueries_BuildEntityQueryParams_MissingObjectID","TestQueries_BuildEntityQueryParams_MissingObjectID"
"","0","returns true if arrays are equal","areArraysSimilar","Fri Mar 27 01:58:59 UTC 2026","passed","Fri Mar 27 01:58:59 UTC 2026","","","",""
"","59","sets autoDisplayTable to true if query returns nodes only, searchType = cypher, and and enabled is true","useExploreTableAutoDisplay","Fri Mar 27 01:58:19 UTC 2026","passed","Fri Mar 27 01:58:19 UTC 2026","","","",""
"Test cases for TestPasswordValidator","0","TestPasswordValidator","","Fri Mar 27 01:54:06 UTC 2026","passed","Fri Mar 27 01:54:06 UTC 2026","","Go Test","github.com/specterops/bloodhound/cmd/api/src/utils/validation/TestPasswordValidator","TestPasswordValidator"
"Test cases for TestSortJSONArrayElements","4","TestSortJSONArrayElements","","Fri Mar 27 01:54:06 UTC 2026","passed","Fri Mar 27 01:54:06 UTC 2026","","Go Test","github.com/specterops/bloodhound/cmd/api/src/utils/test/TestSortJSONArrayElements","TestSortJSONArrayElements"
"","1","returns false when WebGL is not available in the current browser context","WebGL compatibility check","Fri Mar 27 01:59:28 UTC 2026","passed","Fri Mar 27 01:59:28 UTC 2026","","","",""
"","0","returns false if value is 'array'","searchParams","Fri Mar 27 01:57:49 UTC 2026","passed","Fri Mar 27 01:57:49 UTC 2026","","isEmptyParam","",""
"Test cases for TestResources_PatchDomain","1","TestResources_PatchDomain","","Fri Mar 27 01:53:47 UTC 2026","passed","Fri Mar 27 01:53:47 UTC 2026","","Go Test","github.com/specterops/bloodhound/cmd/api/src/api/v2/TestResources_PatchDomain","TestResources_PatchDomain"
"","0","should handle the well formed entities","Evaluating the entity display name from a given entity","Fri Mar 27 01:55:52 UTC 2026","passed","Fri Mar 27 01:55:52 UTC 2026","","","",""
"Test cases for Test_setRawValue","0","Test_setRawValue","","Fri Mar 27 01:53:47 UTC 2026","passed","Fri Mar 27 01:53:47 UTC 2026","","Go Test","github.com/specterops/bloodhound/cmd/api/src/config/Test_setRawValue","Test_setRawValue"
"","0","uppercases boolean values","Formatting boolean properties","Fri Mar 27 01:55:52 UTC 2026","passed","Fri Mar 27 01:55:52 UTC 2026","","","",""
"Test cases for TestManagementResource_ListAuthTokens_Admin","0","TestManagementResource_ListAuthTokens_Admin","","Fri Mar 27 01:54:15 UTC 2026","passed","Fri Mar 27 01:54:15 UTC 2026","","Go Test","github.com/specterops/bloodhound/cmd/api/src/api/v2/auth/TestManagementResource_ListAuthTokens_Admin","TestManagementResource_ListAuthTokens_Admin"
"Test cases for TestParseSkipQueryParameter_Invalid","0","TestParseSkipQueryParameter_Invalid","","Fri Mar 27 01:53:47 UTC 2026","passed","Fri Mar 27 01:53:47 UTC 2026","","Go Test","github.com/specterops/bloodhound/cmd/api/src/api/v2/TestParseSkipQueryParameter_Invalid","TestParseSkipQueryParameter_Invalid"
"Test cases for TestMarshalInt","0","TestMarshalInt","","Fri Mar 27 01:53:49 UTC 2026","passed","Fri Mar 27 01:53:49 UTC 2026","","Go Test","github.com/specterops/bloodhound/cmd/api/src/database/types/null/TestMarshalInt","TestMarshalInt"
"","17","displays CaretDown icon when the sortOrder is desc","ColumnHeaders","Fri Mar 27 01:57:09 UTC 2026","passed","Fri Mar 27 01:57:09 UTC 2026","","SortableHeader","",""
"Test cases for TestOpenGraphSchemaService_GetSchemaFindings","1","TestOpenGraphSchemaService_GetSchemaFindings","","Fri Mar 27 01:53:53 UTC 2026","passed","Fri Mar 27 01:53:53 UTC 2026","","Go Test","github.com/specterops/bloodhound/cmd/api/src/services/opengraphschema/TestOpenGraphSchemaService_GetSchemaFindings","TestOpenGraphSchemaService_GetSchemaFindings"
"","50","should render a navigation list item","MainNav","Fri Mar 27 01:55:29 UTC 2026","passed","Fri Mar 27 01:55:29 UTC 2026","","","",""
"Test cases for TestManagementResource_ListRoles_DBError","1","TestManagementResource_ListRoles_DBError","","Fri Mar 27 01:53:53 UTC 2026","passed","Fri Mar 27 01:53:53 UTC 2026","","Go Test","github.com/specterops/bloodhound/cmd/api/src/api/v2/auth/TestManagementResource_ListRoles_DBError","TestManagementResource_ListRoles_DBError"
"","259","on clicking switch shows modal and when clicking cancel closes it and switch stays enabled","CitrixRDPConfiguration","Fri Mar 27 01:55:57 UTC 2026","passed","Fri Mar 27 01:55:57 UTC 2026","","Click on switch to disable","",""
"Test cases for TestResources_GetBaseEntityInfo","228","TestResources_GetBaseEntityInfo","","Fri Mar 27 01:53:47 UTC 2026","passed","Fri Mar 27 01:53:47 UTC 2026","","Go Test","github.com/specterops/bloodhound/cmd/api/src/api/v2/TestResources_GetBaseEntityInfo","TestResources_GetBaseEntityInfo"
"","121","calls clickHandler when a line item is clicked","PrebuiltSearchList","Fri Mar 27 01:57:45 UTC 2026","passed","Fri Mar 27 01:57:45 UTC 2026","","","",""
"Test cases for TestManagementResource_DeleteUser_BadUserID","0","TestManagementResource_DeleteUser_BadUserID","","Fri Mar 27 01:54:09 UTC 2026","passed","Fri Mar 27 01:54:09 UTC 2026","","Go Test","github.com/specterops/bloodhound/cmd/api/src/api/v2/auth/TestManagementResource_DeleteUser_BadUserID","TestManagementResource_DeleteUser_BadUserID"
"","1","returns default error message for unknown API messages","getErrorMessage","Fri Mar 27 01:55:29 UTC 2026","passed","Fri Mar 27 01:55:29 UTC 2026","","","",""
"","356","handles a selection as expected","DropdownSelector","Fri Mar 27 01:58:10 UTC 2026","passed","Fri Mar 27 01:58:11 UTC 2026","","","",""
"Test cases for TestManagementResource_ListUsers_PredicateMismatchWithColumn","0","TestManagementResource_ListUsers_PredicateMismatchWithColumn","","Fri Mar 27 01:53:53 UTC 2026","passed","Fri Mar 27 01:53:53 UTC 2026","","Go Test","github.com/specterops/bloodhound/cmd/api/src/api/v2/auth/TestManagementResource_ListUsers_PredicateMismatchWithColumn","TestManagementResource_ListUsers_PredicateMismatchWithColumn"
"","95","should render a label and version number when expanded","MainNav","Fri Mar 27 01:55:29 UTC 2026","passed","Fri Mar 27 01:55:29 UTC 2026","","","",""
"Test cases for TestHandleDatabaseError","0","TestHandleDatabaseError","","Fri Mar 27 01:53:37 UTC 2026","passed","Fri Mar 27 01:53:37 UTC 2026","","Go Test","github.com/specterops/bloodhound/cmd/api/src/api/TestHandleDatabaseError","TestHandleDatabaseError"
"Test cases for TestResources_GetAssetGroupSelectorMemberCountsByKind","5","TestResources_GetAssetGroupSelectorMemberCountsByKind","","Fri Mar 27 01:53:47 UTC 2026","passed","Fri Mar 27 01:53:47 UTC 2026","","Go Test","github.com/specterops/bloodhound/cmd/api/src/api/v2/TestResources_GetAssetGroupSelectorMemberCountsByKind","TestResources_GetAssetGroupSelectorMemberCountsByKind"
"Test cases for TestResources_ListADGPOAffectedComputers","1","TestResources_ListADGPOAffectedComputers","","Fri Mar 27 01:53:47 UTC 2026","passed","Fri Mar 27 01:53:47 UTC 2026","","Go Test","github.com/specterops/bloodhound/cmd/api/src/api/v2/TestResources_ListADGPOAffectedComputers","TestResources_ListADGPOAffectedComputers"
"","26","renders correctly when an unexpected nodeType is passed","NodeIcon","Fri Mar 27 01:58:43 UTC 2026","passed","Fri Mar 27 01:58:43 UTC 2026","","","",""
"","60","renders a link to the documentation","BloodHoundConfiguration","Fri Mar 27 02:00:31 UTC 2026","passed","Fri Mar 27 02:00:31 UTC 2026","","","",""
"Test cases for TestIsValidEmail","0","TestIsValidEmail","","Fri Mar 27 01:54:06 UTC 2026","passed","Fri Mar 27 01:54:06 UTC 2026","","Go Test","github.com/specterops/bloodhound/cmd/api/src/utils/TestIsValidEmail","TestIsValidEmail"
"Test cases for TestJSONFloat_MarshalJSON_NaN","0","TestJSONFloat_MarshalJSON_NaN","","Fri Mar 27 01:53:49 UTC 2026","passed","Fri Mar 27 01:53:49 UTC 2026","","Go Test","github.com/specterops/bloodhound/cmd/api/src/database/types/nan/TestJSONFloat_MarshalJSON_NaN","TestJSONFloat_MarshalJSON_NaN"
"","596","renders the form for creating a new rule","Rule Form","Fri Mar 27 01:55:03 UTC 2026","passed","Fri Mar 27 01:55:03 UTC 2026","","","",""
"Test cases for TestTimeEqual","0","TestTimeEqual","","Fri Mar 27 01:53:49 UTC 2026","passed","Fri Mar 27 01:53:49 UTC 2026","","Go Test","github.com/specterops/bloodhound/cmd/api/src/database/types/null/TestTimeEqual","TestTimeEqual"
"","87","returns Tag Object counts when there is a Tag selected but no Rule selected (ruleId is undefined from path params)","useObjectCounts","Fri Mar 27 01:58:54 UTC 2026","passed","Fri Mar 27 01:58:54 UTC 2026","","","",""
"","7","should recognize active directory properties","validating a node property against the shared generated schema","Fri Mar 27 01:55:52 UTC 2026","passed","Fri Mar 27 01:55:52 UTC 2026","","","",""
"Test cases for TestResources_ListADEntityControllers","0","TestResources_ListADEntityControllers","","Fri Mar 27 01:53:47 UTC 2026","passed","Fri Mar 27 01:53:47 UTC 2026","","Go Test","github.com/specterops/bloodhound/cmd/api/src/api/v2/TestResources_ListADEntityControllers","TestResources_ListADEntityControllers"
"Test cases for TestDisenrollMFA_Admin_FailureIncorrectPassword","2277","TestDisenrollMFA_Admin_FailureIncorrectPassword","","Fri Mar 27 01:54:21 UTC 2026","passed","Fri Mar 27 01:54:23 UTC 2026","","Go Test","github.com/specterops/bloodhound/cmd/api/src/api/v2/auth/TestDisenrollMFA_Admin_FailureIncorrectPassword","TestDisenrollMFA_Admin_FailureIncorrectPassword"
"","143","shows ""<10 Days to Expire"" warning when token expires within 10 days","UserTokenManagementDialog - API Expiration Date column","Fri Mar 27 01:55:45 UTC 2026","passed","Fri Mar 27 01:55:45 UTC 2026","","","",""
"","124","Searching for existing node type returns node properties","useFetchEntityInfo","Fri Mar 27 01:56:57 UTC 2026","passed","Fri Mar 27 01:56:58 UTC 2026","","","",""
"","109","should render all of the options as checkboxes","Checkbox group","Fri Mar 27 01:59:05 UTC 2026","passed","Fri Mar 27 01:59:05 UTC 2026","","","",""
"Test cases for TestAssetGroupMembers_Filter_Equals","0","TestAssetGroupMembers_Filter_Equals","","Fri Mar 27 01:53:37 UTC 2026","passed","Fri Mar 27 01:53:37 UTC 2026","","Go Test","github.com/specterops/bloodhound/cmd/api/src/api/TestAssetGroupMembers_Filter_Equals","TestAssetGroupMembers_Filter_Equals"
"","112","does not show View in Explore if in object rule type","Seed Selection Results","Fri Mar 27 01:55:38 UTC 2026","passed","Fri Mar 27 01:55:38 UTC 2026","","","",""
"","8","displays a pulsing indicator","StatusIndicator","Fri Mar 27 01:59:12 UTC 2026","passed","Fri Mar 27 01:59:12 UTC 2026","","","",""
"","2086","Kebab menu click causes the callback function to be called with the correct parameters","ExploreTable","Fri Mar 27 01:54:52 UTC 2026","passed","Fri Mar 27 01:54:54 UTC 2026","","","",""
"Test cases for TestManagementResource_CreateOIDCProvider","1","TestManagementResource_CreateOIDCProvider","","Fri Mar 27 01:54:25 UTC 2026","passed","Fri Mar 27 01:54:25 UTC 2026","","Go Test","github.com/specterops/bloodhound/cmd/api/src/api/v2/auth/TestManagementResource_CreateOIDCProvider","TestManagementResource_CreateOIDCProvider"
"","61","Searching for custom node type with databaseId returns node properties","useFetchEntityInfo","Fri Mar 27 01:56:58 UTC 2026","passed","Fri Mar 27 01:56:58 UTC 2026","","","",""
"","257","closes confirmation dialog when cancel is clicked","ActiveExtensionsCard","Fri Mar 27 01:55:07 UTC 2026","passed","Fri Mar 27 01:55:08 UTC 2026","","","",""
"Test cases for TestResources_GetEdgeACLInheritancePath","105","TestResources_GetEdgeACLInheritancePath","","Fri Mar 27 01:53:47 UTC 2026","passed","Fri Mar 27 01:53:47 UTC 2026","","Go Test","github.com/specterops/bloodhound/cmd/api/src/api/v2/TestResources_GetEdgeACLInheritancePath","TestResources_GetEdgeACLInheritancePath"
"","0","should appropriately handle edges that contain underscores","getEdgeDataFromKey","Fri Mar 27 02:00:26 UTC 2026","passed","Fri Mar 27 02:00:26 UTC 2026","","","",""
"Test cases for TestResources_DeleteSavedQuery_DeleteError","0","TestResources_DeleteSavedQuery_DeleteError","","Fri Mar 27 01:53:47 UTC 2026","passed","Fri Mar 27 01:53:47 UTC 2026","","Go Test","github.com/specterops/bloodhound/cmd/api/src/api/v2/TestResources_DeleteSavedQuery_DeleteError","TestResources_DeleteSavedQuery_DeleteError"
"","407","should render","PasswordResetForm","Fri Mar 27 01:56:54 UTC 2026","passed","Fri Mar 27 01:56:54 UTC 2026","","","",""
"","30","when `selectedItem` is null, the combobox does not display an icon","icon rendering","Fri Mar 27 01:56:02 UTC 2026","passed","Fri Mar 27 01:56:02 UTC 2026","","","",""
"Test cases for TestCache_Set","1","TestCache_Set","","Fri Mar 27 01:54:07 UTC 2026","passed","Fri Mar 27 01:54:07 UTC 2026","","Go Test","github.com/specterops/bloodhound/packages/go/cache/TestCache_Set","TestCache_Set"
"","182","does not make feature-flag request if user is not fully authenticated","app","Fri Mar 27 02:00:17 UTC 2026","passed","Fri Mar 27 02:00:17 UTC 2026","","<Inner />","",""
"","443","should call onSubmit with one time passcode when check code button clicked","OneTimePasscodeForm","Fri Mar 27 01:58:32 UTC 2026","passed","Fri Mar 27 01:58:32 UTC 2026","","","",""
"","449","does not display must be new password error messages when current password is not required","PasswordDialog","Fri Mar 27 01:55:17 UTC 2026","passed","Fri Mar 27 01:55:18 UTC 2026","","","",""
"Test cases for TestGormLogAdapter_Info","0","TestGormLogAdapter_Info","","Fri Mar 27 01:53:49 UTC 2026","passed","Fri Mar 27 01:53:49 UTC 2026","","Go Test","github.com/specterops/bloodhound/cmd/api/src/database/TestGormLogAdapter_Info","TestGormLogAdapter_Info"
"Test cases for TestBoolScan","0","TestBoolScan","","Fri Mar 27 01:53:49 UTC 2026","passed","Fri Mar 27 01:53:49 UTC 2026","","Go Test","github.com/specterops/bloodhound/cmd/api/src/database/types/null/TestBoolScan","TestBoolScan"
"Test cases for TestResources_ListAuditLogs_SkipAndOffset","0","TestResources_ListAuditLogs_SkipAndOffset","","Fri Mar 27 01:53:47 UTC 2026","passed","Fri Mar 27 01:53:47 UTC 2026","","Go Test","github.com/specterops/bloodhound/cmd/api/src/api/v2/TestResources_ListAuditLogs_SkipAndOffset","TestResources_ListAuditLogs_SkipAndOffset"
"Test cases for TestMaybeSubmitNodeUpdate","1","TestMaybeSubmitNodeUpdate","","Fri Mar 27 01:53:52 UTC 2026","passed","Fri Mar 27 01:53:52 UTC 2026","","Go Test","github.com/specterops/bloodhound/cmd/api/src/services/graphify/TestMaybeSubmitNodeUpdate","TestMaybeSubmitNodeUpdate"
"Test cases for TestFlatMap","0","TestFlatMap","","Fri Mar 27 01:54:08 UTC 2026","passed","Fri Mar 27 01:54:08 UTC 2026","","Go Test","github.com/specterops/bloodhound/packages/go/slicesext/TestFlatMap","TestFlatMap"
"","3508","The password reset dialog is opened when switching a user from SAML based authentication to username/password based authentication","Users","Fri Mar 27 01:56:24 UTC 2026","passed","Fri Mar 27 01:56:28 UTC 2026","","","",""
"","24","displays CaretUp icon when the sortOrder is asc","ColumnHeaders","Fri Mar 27 01:57:09 UTC 2026","passed","Fri Mar 27 01:57:09 UTC 2026","","SortableHeader","",""
"","0","The user has yet to type into the search","Getting the text for the disabled item display for a search when there are no results","Fri Mar 27 01:57:19 UTC 2026","passed","Fri Mar 27 01:57:19 UTC 2026","","Empty data states","",""
"Test cases for TestTimeScanValue","0","TestTimeScanValue","","Fri Mar 27 01:53:49 UTC 2026","passed","Fri Mar 27 01:53:49 UTC 2026","","Go Test","github.com/specterops/bloodhound/cmd/api/src/database/types/null/TestTimeScanValue","TestTimeScanValue"
"Test cases for TestResources_ListADComputerSQLAdmins","5","TestResources_ListADComputerSQLAdmins","","Fri Mar 27 01:53:47 UTC 2026","passed","Fri Mar 27 01:53:47 UTC 2026","","Go Test","github.com/specterops/bloodhound/cmd/api/src/api/v2/TestResources_ListADComputerSQLAdmins","TestResources_ListADComputerSQLAdmins"
"","429","clears the applied filter","FileIngestFilterDialog","Fri Mar 27 01:55:38 UTC 2026","passed","Fri Mar 27 01:55:38 UTC 2026","","User Select","",""
"Test cases for TestManagementResource_ListUsers_InvalidColumn","0","TestManagementResource_ListUsers_InvalidColumn","","Fri Mar 27 01:53:53 UTC 2026","passed","Fri Mar 27 01:53:53 UTC 2026","","Go Test","github.com/specterops/bloodhound/cmd/api/src/api/v2/auth/TestManagementResource_ListUsers_InvalidColumn","TestManagementResource_ListUsers_InvalidColumn"
"","14","renders nothing if flag is disabled and disabled prop is not provided","FeatureFlag","Fri Mar 27 01:58:13 UTC 2026","passed","Fri Mar 27 01:58:13 UTC 2026","","","",""
"","244","AZRole information panel will not display a section for PIM Assignments","EntityInfoContent","Fri Mar 27 01:57:04 UTC 2026","passed","Fri Mar 27 01:57:04 UTC 2026","","","",""
"Test cases for Test_UseHarness","0","Test_UseHarness","","Fri Mar 27 01:54:08 UTC 2026","passed","Fri Mar 27 01:54:08 UTC 2026","","Go Test","github.com/specterops/bloodhound/packages/go/lab/Test_UseHarness","Test_UseHarness"
"Test cases for Test_ParseAndValidatePayload","6","Test_ParseAndValidatePayload","","Fri Mar 27 01:53:53 UTC 2026","passed","Fri Mar 27 01:53:53 UTC 2026","","Go Test","github.com/specterops/bloodhound/cmd/api/src/services/upload/Test_ParseAndValidatePayload","Test_ParseAndValidatePayload"
"Test cases for TestUnmarshalInt64OverflowToInt64","0","TestUnmarshalInt64OverflowToInt64","","Fri Mar 27 01:53:49 UTC 2026","passed","Fri Mar 27 01:53:49 UTC 2026","","Go Test","github.com/specterops/bloodhound/cmd/api/src/database/types/null/TestUnmarshalInt64OverflowToInt64","TestUnmarshalInt64OverflowToInt64"
"","83","should call onCancel when return to login button clicked","PasswordResetForm","Fri Mar 27 01:56:57 UTC 2026","passed","Fri Mar 27 01:56:58 UTC 2026","","","",""
"Test cases for TestResources_GetAZEntityInformation","130","TestResources_GetAZEntityInformation","","Fri Mar 27 01:53:47 UTC 2026","passed","Fri Mar 27 01:53:47 UTC 2026","","Go Test","github.com/specterops/bloodhound/cmd/api/src/api/v2/TestResources_GetAZEntityInformation","TestResources_GetAZEntityInformation"
"","0","returns all collected environments when aggegation type is all","getEnvironmentAggregationIds","Fri Mar 27 01:55:00 UTC 2026","passed","Fri Mar 27 01:55:00 UTC 2026","","","",""
"","9","fully replaces state","useObjectState","Fri Mar 27 01:58:37 UTC 2026","passed","Fri Mar 27 01:58:37 UTC 2026","","","",""
"","668","displays correct content based on platform filter Azure","CommonSearches","Fri Mar 27 01:55:49 UTC 2026","passed","Fri Mar 27 01:55:49 UTC 2026","","","",""
"Test cases for TestClearCache_HA","0","TestClearCache_HA","","Fri Mar 27 01:53:48 UTC 2026","passed","Fri Mar 27 01:53:48 UTC 2026","","Go Test","github.com/specterops/bloodhound/cmd/api/src/daemons/changelog/TestClearCache_HA","TestClearCache_HA"
"","424","should call ""onSave"" one time","Enable2FADialog","Fri Mar 27 01:58:01 UTC 2026","passed","Fri Mar 27 01:58:01 UTC 2026","user clicks ""Disable Multi-Factor Authentication"" button","user enters valid password","",""
"","222","renders the QuerySearchFilter component","QuerySearchFilter","Fri Mar 27 01:57:27 UTC 2026","passed","Fri Mar 27 01:57:27 UTC 2026","","","",""
"","181","renders a snackbar notification in the dom and tests the long autoHideDuration","AppNotifications","Fri Mar 27 01:58:04 UTC 2026","passed","Fri Mar 27 01:58:05 UTC 2026","","","",""
"","571","displays current password error messages when current password is empty","PasswordDialog","Fri Mar 27 01:55:16 UTC 2026","passed","Fri Mar 27 01:55:17 UTC 2026","","","",""
"","1326","should render","EdgeInfoHeader","Fri Mar 27 01:57:57 UTC 2026","passed","Fri Mar 27 01:57:58 UTC 2026","","","",""
"","19","will update the selected filters based on the values stored in query params when the initialize function is called","usePathfindingFilters","Fri Mar 27 01:58:47 UTC 2026","passed","Fri Mar 27 01:58:47 UTC 2026","","","",""
"Test cases for TestFoldl","0","TestFoldl","","Fri Mar 27 01:54:08 UTC 2026","passed","Fri Mar 27 01:54:08 UTC 2026","","Go Test","github.com/specterops/bloodhound/packages/go/slicesext/TestFoldl","TestFoldl"
"","58","shows the direct object empty and expanded object list empty, when no results in both","Seed Selection Results","Fri Mar 27 01:55:38 UTC 2026","passed","Fri Mar 27 01:55:38 UTC 2026","","","",""
"Test cases for TestMap","0","TestMap","","Fri Mar 27 01:54:08 UTC 2026","passed","Fri Mar 27 01:54:08 UTC 2026","","Go Test","github.com/specterops/bloodhound/packages/go/lab/internal/TestMap","TestMap"
"Test cases for TestManagementResource_UpdateSAMLProviderRequest","10","TestManagementResource_UpdateSAMLProviderRequest","","Fri Mar 27 01:54:25 UTC 2026","passed","Fri Mar 27 01:54:25 UTC 2026","","Go Test","github.com/specterops/bloodhound/cmd/api/src/api/v2/auth/TestManagementResource_UpdateSAMLProviderRequest","TestManagementResource_UpdateSAMLProviderRequest"
