"DESCRIPTION","DURATION IN MS","NAME","PARENT SUITE","START TIME","STATUS","STOP TIME","SUB SUITE","SUITE","TEST CLASS","TEST METHOD"
"Test cases for TestConvertDomainToNode_InheritanceHashes","0","TestConvertDomainToNode_InheritanceHashes","","Fri Mar 27 01:54:07 UTC 2026","passed","Fri Mar 27 01:54:07 UTC 2026","","Go Test","github.com/specterops/bloodhound/packages/go/ein/TestConvertDomainToNode_InheritanceHashes","TestConvertDomainToNode_InheritanceHashes"
"Test cases for TestResources_ListADDomainDCSyncers","0","TestResources_ListADDomainDCSyncers","","Fri Mar 27 01:53:47 UTC 2026","passed","Fri Mar 27 01:53:47 UTC 2026","","Go Test","github.com/specterops/bloodhound/cmd/api/src/api/v2/TestResources_ListADDomainDCSyncers","TestResources_ListADDomainDCSyncers"
"","97","calls handleFilterChange with all filter types and empty strings when clicked while filters are active","AssetGroupEdit","Fri Mar 27 01:55:58 UTC 2026","passed","Fri Mar 27 01:55:58 UTC 2026","","Clear Filters button","",""
"","37","should redirect to nested /file-ingest route if user navigates to an invalid route","Administration","Fri Mar 27 02:00:16 UTC 2026","passed","Fri Mar 27 02:00:16 UTC 2026","","","",""
"Test cases for TestWriteErrorResponse_InvalidFormat","0","TestWriteErrorResponse_InvalidFormat","","Fri Mar 27 01:53:37 UTC 2026","passed","Fri Mar 27 01:53:37 UTC 2026","","Go Test","github.com/specterops/bloodhound/cmd/api/src/api/TestWriteErrorResponse_InvalidFormat","TestWriteErrorResponse_InvalidFormat"
"","1","returns name uniqueness message for ""name must be unique""","getErrorMessage","Fri Mar 27 01:55:29 UTC 2026","passed","Fri Mar 27 01:55:29 UTC 2026","","","",""
"","0","abbreviates numbers larger than 1000 and should not round the tenth place digit","numberFormatting","Fri Mar 27 01:57:14 UTC 2026","passed","Fri Mar 27 01:57:14 UTC 2026","","","",""
"","69","should render when search string is at the beginning of the text","HighlightedText","Fri Mar 27 01:58:35 UTC 2026","passed","Fri Mar 27 01:58:35 UTC 2026","","","",""
"","755","should call onSubmit when input is valid and Submit button is clicked","UpsertSAMLProviderForm","Fri Mar 27 01:58:09 UTC 2026","passed","Fri Mar 27 01:58:10 UTC 2026","","","",""
"","442","On successful upload, displays a completion of 100% and adds a ""Complete"" button that closes the dialog","SchemaUploadDialog","Fri Mar 27 01:56:32 UTC 2026","passed","Fri Mar 27 01:56:32 UTC 2026","","","",""
"Test cases for TestResources_GetAssetGroupTagMemberCountsByKind","3","TestResources_GetAssetGroupTagMemberCountsByKind","","Fri Mar 27 01:53:47 UTC 2026","passed","Fri Mar 27 01:53:47 UTC 2026","","Go Test","github.com/specterops/bloodhound/cmd/api/src/api/v2/TestResources_GetAssetGroupTagMemberCountsByKind","TestResources_GetAssetGroupTagMemberCountsByKind"
"","54","disables delete button for built-in extensions","ActiveExtensionsCard","Fri Mar 27 01:55:08 UTC 2026","passed","Fri Mar 27 01:55:08 UTC 2026","","","",""
"Test cases for Test_SetDependency","0","Test_SetDependency","","Fri Mar 27 01:54:08 UTC 2026","passed","Fri Mar 27 01:54:08 UTC 2026","","Go Test","github.com/specterops/bloodhound/packages/go/lab/Test_SetDependency","Test_SetDependency"
"","83","copys children value to clipboard after clicking the copy btn","CodeController","Fri Mar 27 01:59:05 UTC 2026","passed","Fri Mar 27 01:59:05 UTC 2026","","","",""
"Test cases for TestCreateUser_ETAC","4780","TestCreateUser_ETAC","","Fri Mar 27 01:53:56 UTC 2026","passed","Fri Mar 27 01:54:01 UTC 2026","","Go Test","github.com/specterops/bloodhound/cmd/api/src/api/v2/auth/TestCreateUser_ETAC","TestCreateUser_ETAC"
"","218","toggles parent from none to all","SourceKindsCheckboxes","Fri Mar 27 01:56:41 UTC 2026","passed","Fri Mar 27 01:56:41 UTC 2026","","","",""
"","457","changes the text from ""Disabled"" to ""Enabled"" when the Rule Status switch is toggled","Rule Form","Fri Mar 27 01:55:04 UTC 2026","passed","Fri Mar 27 01:55:05 UTC 2026","","","",""
"","25","tag members refetches on environment change","the useAssetGroupTags utilities","Fri Mar 27 01:55:42 UTC 2026","passed","Fri Mar 27 01:55:42 UTC 2026","","","",""
"Test cases for TestMarshalBoolText","0","TestMarshalBoolText","","Fri Mar 27 01:53:49 UTC 2026","passed","Fri Mar 27 01:53:49 UTC 2026","","Go Test","github.com/specterops/bloodhound/cmd/api/src/database/types/null/TestMarshalBoolText","TestMarshalBoolText"
"","1","floors DateTime objects to the nearest minute","floorToNearestMinute","Fri Mar 27 01:58:37 UTC 2026","passed","Fri Mar 27 01:58:37 UTC 2026","","","",""
"Test cases for TestManagementResource_DeleteAuthToken","10","TestManagementResource_DeleteAuthToken","","Fri Mar 27 01:54:25 UTC 2026","passed","Fri Mar 27 01:54:25 UTC 2026","","Go Test","github.com/specterops/bloodhound/cmd/api/src/api/v2/auth/TestManagementResource_DeleteAuthToken","TestManagementResource_DeleteAuthToken"
"","142","should call onLoginViaSAML when login via sso button clicked","LoginForm","Fri Mar 27 01:58:41 UTC 2026","passed","Fri Mar 27 01:58:41 UTC 2026","","","",""
"Test cases for TestResources_ListADEntityDCOMRights","0","TestResources_ListADEntityDCOMRights","","Fri Mar 27 01:53:47 UTC 2026","passed","Fri Mar 27 01:53:47 UTC 2026","","Go Test","github.com/specterops/bloodhound/cmd/api/src/api/v2/TestResources_ListADEntityDCOMRights","TestResources_ListADEntityDCOMRights"
"","198","should call the onClick function when clicked","GraphButton","Fri Mar 27 01:59:23 UTC 2026","passed","Fri Mar 27 01:59:24 UTC 2026","","","",""
"Test cases for TestResources_ListADDomainInboundTrusts","3","TestResources_ListADDomainInboundTrusts","","Fri Mar 27 01:53:47 UTC 2026","passed","Fri Mar 27 01:53:47 UTC 2026","","Go Test","github.com/specterops/bloodhound/cmd/api/src/api/v2/TestResources_ListADDomainInboundTrusts","TestResources_ListADDomainInboundTrusts"
"Test cases for TestManagementResource_UpdateUser_IDMalformed","923","TestManagementResource_UpdateUser_IDMalformed","","Fri Mar 27 01:54:02 UTC 2026","passed","Fri Mar 27 01:54:03 UTC 2026","","Go Test","github.com/specterops/bloodhound/cmd/api/src/api/v2/auth/TestManagementResource_UpdateUser_IDMalformed","TestManagementResource_UpdateUser_IDMalformed"
"Test cases for Test_ValidateGraph","8","Test_ValidateGraph","","Fri Mar 27 01:53:53 UTC 2026","passed","Fri Mar 27 01:53:53 UTC 2026","","Go Test","github.com/specterops/bloodhound/cmd/api/src/services/upload/Test_ValidateGraph","Test_ValidateGraph"
"","236","displays validation error messages when Save button is clicked and no form input is provided","PasswordDialog","Fri Mar 27 01:55:14 UTC 2026","passed","Fri Mar 27 01:55:14 UTC 2026","","","",""
"","50","displays a status indicator","StatusIndicator","Fri Mar 27 01:59:12 UTC 2026","passed","Fri Mar 27 01:59:12 UTC 2026","","","",""
"","130","renders details for a selected rule and is of type ""Cypher""","DynamicDetails","Fri Mar 27 01:56:18 UTC 2026","passed","Fri Mar 27 01:56:19 UTC 2026","","","",""
"","135","renders enabled Zone and Object tabs and disabled Rule tab","Selected Details Tabs","Fri Mar 27 01:56:26 UTC 2026","passed","Fri Mar 27 01:56:26 UTC 2026","","Selected Details Tabs - Params present","",""
"Test cases for TestUnmarshalNonIntegerNumberToInt64","0","TestUnmarshalNonIntegerNumberToInt64","","Fri Mar 27 01:53:49 UTC 2026","passed","Fri Mar 27 01:53:49 UTC 2026","","Go Test","github.com/specterops/bloodhound/cmd/api/src/database/types/null/TestUnmarshalNonIntegerNumberToInt64","TestUnmarshalNonIntegerNumberToInt64"
"","547","renders trigger button and dropdown items","TagToZoneLabel","Fri Mar 27 01:54:57 UTC 2026","passed","Fri Mar 27 01:54:58 UTC 2026","","","",""
"","260","calls the onReset prop when the crop button is clicked","GraphControls","Fri Mar 27 01:55:26 UTC 2026","passed","Fri Mar 27 01:55:27 UTC 2026","","Resetting graph","",""
"","595","renders a list of asset group members","GroupManagement","Fri Mar 27 02:00:07 UTC 2026","passed","Fri Mar 27 02:00:08 UTC 2026","","","",""
"","61","returns when zone limit is reached","useTagLimits","Fri Mar 27 01:55:14 UTC 2026","passed","Fri Mar 27 01:55:14 UTC 2026","","","",""
"Test cases for TestDomainSelectors_GetFilterableColumns","0","TestDomainSelectors_GetFilterableColumns","","Fri Mar 27 01:53:49 UTC 2026","passed","Fri Mar 27 01:53:49 UTC 2026","","Go Test","github.com/specterops/bloodhound/cmd/api/src/model/TestDomainSelectors_GetFilterableColumns","TestDomainSelectors_GetFilterableColumns"
"","3","returns undefined if graphData is undefined","normalizeGraphDataForSigma","Fri Mar 27 02:00:24 UTC 2026","passed","Fri Mar 27 02:00:24 UTC 2026","","","",""
"","8","should render when search string at the end of the text","HighlightedText","Fri Mar 27 01:58:35 UTC 2026","passed","Fri Mar 27 01:58:35 UTC 2026","","","",""
"Test cases for TestStringPointer","0","TestStringPointer","","Fri Mar 27 01:53:49 UTC 2026","passed","Fri Mar 27 01:53:49 UTC 2026","","Go Test","github.com/specterops/bloodhound/cmd/api/src/database/types/null/TestStringPointer","TestStringPointer"
"","1","determines glyphs with the tier_managent_engine feature flag enabled","getNodeGlyphs","Fri Mar 27 02:00:00 UTC 2026","passed","Fri Mar 27 02:00:00 UTC 2026","","","",""
"","574","calls onSave without current password when requireCurrentPassword is false","PasswordDialog","Fri Mar 27 01:55:18 UTC 2026","passed","Fri Mar 27 01:55:19 UTC 2026","","","",""
"Test cases for TestDetectBOMEncoding","1","TestDetectBOMEncoding","","Fri Mar 27 01:54:07 UTC 2026","passed","Fri Mar 27 01:54:07 UTC 2026","","Go Test","github.com/specterops/bloodhound/packages/go/bomenc/TestDetectBOMEncoding","TestDetectBOMEncoding"
"","0","returns all environments when both ""yes"" and ""no"" filters are active","filterAndSearchEnvironments","Fri Mar 27 01:55:00 UTC 2026","passed","Fri Mar 27 01:55:00 UTC 2026","","collected filters","",""
"","0","returns paramValue as EnvironmentAggregation if paramValue is azure","useEnvironmentParams","Fri Mar 27 01:59:19 UTC 2026","passed","Fri Mar 27 01:59:19 UTC 2026","","parseEnvironmentAggregation","",""
"Test cases for TestManagementResource_SSOLoginHandler","5","TestManagementResource_SSOLoginHandler","","Fri Mar 27 01:54:25 UTC 2026","passed","Fri Mar 27 01:54:25 UTC 2026","","Go Test","github.com/specterops/bloodhound/cmd/api/src/api/v2/auth/TestManagementResource_SSOLoginHandler","TestManagementResource_SSOLoginHandler"
"","378","renders a list of pre-built searches","PrebuiltSearchList","Fri Mar 27 01:57:45 UTC 2026","passed","Fri Mar 27 01:57:45 UTC 2026","","","",""
"","2","rounds down fractional minutes/days","getSimpleDuration","Fri Mar 27 01:58:37 UTC 2026","passed","Fri Mar 27 01:58:37 UTC 2026","","","",""
"Test cases for Test_filterNodesToSearchResult_includeOpenGraphNodes","0","Test_filterNodesToSearchResult_includeOpenGraphNodes","","Fri Mar 27 01:53:51 UTC 2026","passed","Fri Mar 27 01:53:51 UTC 2026","","Go Test","github.com/specterops/bloodhound/cmd/api/src/queries/Test_filterNodesToSearchResult_includeOpenGraphNodes","Test_filterNodesToSearchResult_includeOpenGraphNodes"
"Test cases for TestManagementResource_ListAuthTokens_SortingError","0","TestManagementResource_ListAuthTokens_SortingError","","Fri Mar 27 01:54:15 UTC 2026","passed","Fri Mar 27 01:54:15 UTC 2026","","Go Test","github.com/specterops/bloodhound/cmd/api/src/api/v2/auth/TestManagementResource_ListAuthTokens_SortingError","TestManagementResource_ListAuthTokens_SortingError"
"Test cases for TestSIDSuffix_PrependPrefix","2","TestSIDSuffix_PrependPrefix","","Fri Mar 27 01:54:07 UTC 2026","passed","Fri Mar 27 01:54:07 UTC 2026","","Go Test","github.com/specterops/bloodhound/packages/go/analysis/ad/wellknown/TestSIDSuffix_PrependPrefix","TestSIDSuffix_PrependPrefix"
"","0","accepts a sort and compare function","areArraysSimilar","Fri Mar 27 01:58:59 UTC 2026","passed","Fri Mar 27 01:58:59 UTC 2026","","","",""
"","181","renders Zone as first tab and is also the initially selected on first render in Zone View/Tab","Selected Details Tabs","Fri Mar 27 01:56:26 UTC 2026","passed","Fri Mar 27 01:56:26 UTC 2026","","Selected Details Tabs - Params present","",""
"","67","when session token or user are null, redirects to /login","AuthenticatedRoute","Fri Mar 27 02:00:16 UTC 2026","passed","Fri Mar 27 02:00:16 UTC 2026","","","",""
"","145","renders correctly","NodeIcon","Fri Mar 27 01:58:43 UTC 2026","passed","Fri Mar 27 01:58:43 UTC 2026","","","",""
"","19","should display hidden label for hidden edge","EdgeInfoHeader","Fri Mar 27 01:57:58 UTC 2026","passed","Fri Mar 27 01:57:58 UTC 2026","","","",""
"","143","displays a table of completed ingest logs","FileIngest","Fri Mar 27 01:58:30 UTC 2026","passed","Fri Mar 27 01:58:30 UTC 2026","","","",""
"","205","Verify Vault Reader count is the count returned by All Readers","EntityInfoDataTableGraphed","Fri Mar 27 01:56:07 UTC 2026","passed","Fri Mar 27 01:56:07 UTC 2026","","Node count for Vault Readers nested table","",""
"","62","should on clicking remove call clearSelectedItem","EntityInfoHeader","Fri Mar 27 01:57:42 UTC 2026","passed","Fri Mar 27 01:57:42 UTC 2026","","","",""
"Test cases for TestResources_ListAuditLogs_PredicateMismatchWithColumn","0","TestResources_ListAuditLogs_PredicateMismatchWithColumn","","Fri Mar 27 01:53:47 UTC 2026","passed","Fri Mar 27 01:53:47 UTC 2026","","Go Test","github.com/specterops/bloodhound/cmd/api/src/api/v2/TestResources_ListAuditLogs_PredicateMismatchWithColumn","TestResources_ListAuditLogs_PredicateMismatchWithColumn"
"","67","shows an error notification if there is an error fetching","useFinishedJobs","Fri Mar 27 01:56:48 UTC 2026","passed","Fri Mar 27 01:56:48 UTC 2026","","","",""
"Test cases for TestResources_GetAssetGroupMemberCount_IDMalformed","0","TestResources_GetAssetGroupMemberCount_IDMalformed","","Fri Mar 27 01:53:47 UTC 2026","passed","Fri Mar 27 01:53:47 UTC 2026","","Go Test","github.com/specterops/bloodhound/cmd/api/src/api/v2/TestResources_GetAssetGroupMemberCount_IDMalformed","TestResources_GetAssetGroupMemberCount_IDMalformed"
"","7","removes a notification","AppNotifications","Fri Mar 27 01:58:04 UTC 2026","passed","Fri Mar 27 01:58:04 UTC 2026","","","",""
"Test cases for TestResources_GetPathfindingResult","0","TestResources_GetPathfindingResult","","Fri Mar 27 01:53:47 UTC 2026","passed","Fri Mar 27 01:53:47 UTC 2026","","Go Test","github.com/specterops/bloodhound/cmd/api/src/api/v2/TestResources_GetPathfindingResult","TestResources_GetPathfindingResult"
"","62","returns the full environment of the environmentId found in the search params","useAvailableEnvironments","Fri Mar 27 01:58:25 UTC 2026","passed","Fri Mar 27 01:58:25 UTC 2026","","useSelectedEnvironment","",""
"","2463","Sort arrow is visible and direction is correct","ExploreTable","Fri Mar 27 01:54:54 UTC 2026","passed","Fri Mar 27 01:54:56 UTC 2026","","","",""
"Test cases for TestGraphQuery_PrepareCypherQuery","40","TestGraphQuery_PrepareCypherQuery","","Fri Mar 27 01:53:51 UTC 2026","passed","Fri Mar 27 01:53:51 UTC 2026","","Go Test","github.com/specterops/bloodhound/cmd/api/src/queries/TestGraphQuery_PrepareCypherQuery","TestGraphQuery_PrepareCypherQuery"
"","448","should render","LoginViaSSOForm","Fri Mar 27 01:57:46 UTC 2026","passed","Fri Mar 27 01:57:46 UTC 2026","","","",""
"","0","runs a pathfinding search when the query param is set to ""pathfinding""","useExploreGraph","Fri Mar 27 01:56:12 UTC 2026","passed","Fri Mar 27 01:56:12 UTC 2026","","exploreGraphQueryFactory","",""
"Test cases for TestSavedQueries_IsString","0","TestSavedQueries_IsString","","Fri Mar 27 01:53:49 UTC 2026","passed","Fri Mar 27 01:53:49 UTC 2026","","Go Test","github.com/specterops/bloodhound/cmd/api/src/model/TestSavedQueries_IsString","TestSavedQueries_IsString"
"","84","disables items via itemDisabled and hides the chevron icon visually","<DetailsAccordion />","Fri Mar 27 01:55:42 UTC 2026","passed","Fri Mar 27 01:55:42 UTC 2026","","","",""
"Test cases for TestDatabase_checkError_OtherError","0","TestDatabase_checkError_OtherError","","Fri Mar 27 01:53:49 UTC 2026","passed","Fri Mar 27 01:53:49 UTC 2026","","Go Test","github.com/specterops/bloodhound/cmd/api/src/database/TestDatabase_checkError_OtherError","TestDatabase_checkError_OtherError"
"","1961","should add an option and display the changelog when it is clicked","AssetGroupEdit","Fri Mar 27 01:57:43 UTC 2026","passed","Fri Mar 27 01:57:45 UTC 2026","","","",""
"","10","renders the LabelSelector when available and on a Label page","TagSelector","Fri Mar 27 01:57:35 UTC 2026","passed","Fri Mar 27 01:57:35 UTC 2026","","","",""
"Test cases for TestManagementResource_GetSelf","0","TestManagementResource_GetSelf","","Fri Mar 27 01:54:09 UTC 2026","passed","Fri Mar 27 01:54:09 UTC 2026","","Go Test","github.com/specterops/bloodhound/cmd/api/src/api/v2/auth/TestManagementResource_GetSelf","TestManagementResource_GetSelf"
"Test cases for TestRoleMembers","0","TestRoleMembers","","Fri Mar 27 01:54:07 UTC 2026","passed","Fri Mar 27 01:54:07 UTC 2026","","Go Test","github.com/specterops/bloodhound/packages/go/analysis/azure/TestRoleMembers","TestRoleMembers"
"","581","displays a Upload Files button","FileIngest","Fri Mar 27 01:58:29 UTC 2026","passed","Fri Mar 27 01:58:30 UTC 2026","","","",""
"","525","should not allow the input to exceed the allowed length","CreateUserForm","Fri Mar 27 01:55:24 UTC 2026","passed","Fri Mar 27 01:55:25 UTC 2026","","","",""
"Test cases for TestResources_UpdateSavedQuery_InvalidID","2","TestResources_UpdateSavedQuery_InvalidID","","Fri Mar 27 01:53:47 UTC 2026","passed","Fri Mar 27 01:53:47 UTC 2026","","Go Test","github.com/specterops/bloodhound/cmd/api/src/api/v2/TestResources_UpdateSavedQuery_InvalidID","TestResources_UpdateSavedQuery_InvalidID"
"Test cases for TestSignRequestAtInternalError","0","TestSignRequestAtInternalError","","Fri Mar 27 01:53:37 UTC 2026","passed","Fri Mar 27 01:53:37 UTC 2026","","Go Test","github.com/specterops/bloodhound/cmd/api/src/api/TestSignRequestAtInternalError","TestSignRequestAtInternalError"
"","0","returns false if arrays have different elements","areArraysSimilar","Fri Mar 27 01:58:59 UTC 2026","passed","Fri Mar 27 01:58:59 UTC 2026","","","",""
"Test cases for TestManagementResource_ListRoles_PredicateMismatchWithColumn","0","TestManagementResource_ListRoles_PredicateMismatchWithColumn","","Fri Mar 27 01:53:53 UTC 2026","passed","Fri Mar 27 01:53:53 UTC 2026","","Go Test","github.com/specterops/bloodhound/cmd/api/src/api/v2/auth/TestManagementResource_ListRoles_PredicateMismatchWithColumn","TestManagementResource_ListRoles_PredicateMismatchWithColumn"
"","10","sets autoDisplayTable to false if query type is composition","useExploreTableAutoDisplay","Fri Mar 27 01:58:19 UTC 2026","passed","Fri Mar 27 01:58:19 UTC 2026","","","",""
"","514","renders correctly with requiresCurrentPassword false","PasswordDialog","Fri Mar 27 01:55:13 UTC 2026","passed","Fri Mar 27 01:55:14 UTC 2026","","","",""
"","2652","should close the edge filtering dialog when user clicks cancel button","EdgeFilter","Fri Mar 27 01:56:59 UTC 2026","passed","Fri Mar 27 01:57:02 UTC 2026","","","",""
"Test cases for TestManagementResource_UpdateUser_Success","756","TestManagementResource_UpdateUser_Success","","Fri Mar 27 01:54:12 UTC 2026","passed","Fri Mar 27 01:54:13 UTC 2026","","Go Test","github.com/specterops/bloodhound/cmd/api/src/api/v2/auth/TestManagementResource_UpdateUser_Success","TestManagementResource_UpdateUser_Success"
"","334","renders the Object Tab content when Object tab is chosen","Selected Details Tab Content","Fri Mar 27 01:58:33 UTC 2026","passed","Fri Mar 27 01:58:34 UTC 2026","","","",""
"","1","should compute offset vertices for bezier curves at a given intersection","bezier","Fri Mar 27 02:00:11 UTC 2026","passed","Fri Mar 27 02:00:11 UTC 2026","","","",""
"","261","sets the calendar date to match the valid","ManagedDatePicker - value","Fri Mar 27 01:57:04 UTC 2026","passed","Fri Mar 27 01:57:04 UTC 2026","","","",""
"","29","the queries in the list only include nodes and edges that are defined in our schema","common search list","Fri Mar 27 01:58:57 UTC 2026","passed","Fri Mar 27 01:58:57 UTC 2026","","","",""
"","185","toggles a child on","SourceKindsCheckboxes","Fri Mar 27 01:56:41 UTC 2026","passed","Fri Mar 27 01:56:41 UTC 2026","","","",""
"","52","Should display a list of the asset group members","AssetGroupMemberList","Fri Mar 27 01:58:35 UTC 2026","passed","Fri Mar 27 01:58:35 UTC 2026","","","",""
"Test cases for Test_runMaybeCachedEntityQuery","1","Test_runMaybeCachedEntityQuery","","Fri Mar 27 01:53:51 UTC 2026","passed","Fri Mar 27 01:53:51 UTC 2026","","Go Test","github.com/specterops/bloodhound/cmd/api/src/queries/Test_runMaybeCachedEntityQuery","Test_runMaybeCachedEntityQuery"
"Test cases for TestTimeFromPtr","0","TestTimeFromPtr","","Fri Mar 27 01:53:49 UTC 2026","passed","Fri Mar 27 01:53:49 UTC 2026","","Go Test","github.com/specterops/bloodhound/cmd/api/src/database/types/null/TestTimeFromPtr","TestTimeFromPtr"
"Test cases for TestResources_GetFlags","3","TestResources_GetFlags","","Fri Mar 27 01:53:47 UTC 2026","passed","Fri Mar 27 01:53:47 UTC 2026","","Go Test","github.com/specterops/bloodhound/cmd/api/src/api/v2/TestResources_GetFlags","TestResources_GetFlags"
"","78","indicates that filters are active","AssetGroupEdit","Fri Mar 27 01:55:56 UTC 2026","passed","Fri Mar 27 01:55:57 UTC 2026","","","",""
"","103","calls setSelected with correct data on click","NoteCell component","Fri Mar 27 01:58:00 UTC 2026","passed","Fri Mar 27 01:58:00 UTC 2026","","","",""
"Test cases for TestCreateAssetGroupRequest_AuditData","0","TestCreateAssetGroupRequest_AuditData","","Fri Mar 27 01:53:47 UTC 2026","passed","Fri Mar 27 01:53:47 UTC 2026","","Go Test","github.com/specterops/bloodhound/cmd/api/src/api/v2/TestCreateAssetGroupRequest_AuditData","TestCreateAssetGroupRequest_AuditData"
"","233","displays an error when unable to fetch data","EarlyAccessFeatures","Fri Mar 27 02:00:09 UTC 2026","passed","Fri Mar 27 02:00:09 UTC 2026","","","",""
"Test cases for TestManagementResource_DeleteUser_Success","758","TestManagementResource_DeleteUser_Success","","Fri Mar 27 01:54:11 UTC 2026","passed","Fri Mar 27 01:54:12 UTC 2026","","Go Test","github.com/specterops/bloodhound/cmd/api/src/api/v2/auth/TestManagementResource_DeleteUser_Success","TestManagementResource_DeleteUser_Success"
"Test cases for TestTypes_Scan_Success","0","TestTypes_Scan_Success","","Fri Mar 27 01:53:49 UTC 2026","passed","Fri Mar 27 01:53:49 UTC 2026","","Go Test","github.com/specterops/bloodhound/cmd/api/src/database/types/TestTypes_Scan_Success","TestTypes_Scan_Success"
"","588","should render","ExploreTable","Fri Mar 27 01:54:42 UTC 2026","passed","Fri Mar 27 01:54:42 UTC 2026","","","",""
"","0","No type was provided and no results were available","Getting the text for the disabled item display for a search when there are no results","Fri Mar 27 01:57:19 UTC 2026","passed","Fri Mar 27 01:57:19 UTC 2026","","Empty data states","",""
"","0","returns Object ID message when ruleType is SeedTypeObjectId and seeds are required","getErrorMessage","Fri Mar 27 01:55:29 UTC 2026","passed","Fri Mar 27 01:55:29 UTC 2026","","","",""
"","20","allows you to cancel filter updates before applying them to the url and reset to the default filter state","usePathfindingFilters","Fri Mar 27 01:58:47 UTC 2026","passed","Fri Mar 27 01:58:47 UTC 2026","","","",""
"Test cases for TestAssetGroupSelectorSpec_Validate","0","TestAssetGroupSelectorSpec_Validate","","Fri Mar 27 01:53:49 UTC 2026","passed","Fri Mar 27 01:53:49 UTC 2026","","Go Test","github.com/specterops/bloodhound/cmd/api/src/model/TestAssetGroupSelectorSpec_Validate","TestAssetGroupSelectorSpec_Validate"
"Test cases for TestManagementResource_ListUsers_Filtered","0","TestManagementResource_ListUsers_Filtered","","Fri Mar 27 01:53:53 UTC 2026","passed","Fri Mar 27 01:53:53 UTC 2026","","Go Test","github.com/specterops/bloodhound/cmd/api/src/api/v2/auth/TestManagementResource_ListUsers_Filtered","TestManagementResource_ListUsers_Filtered"
"Test cases for Test_filterNodesToSearchResult_filterEnvironments_tenantIDFail","0","Test_filterNodesToSearchResult_filterEnvironments_tenantIDFail","","Fri Mar 27 01:53:51 UTC 2026","passed","Fri Mar 27 01:53:51 UTC 2026","","Go Test","github.com/specterops/bloodhound/cmd/api/src/queries/Test_filterNodesToSearchResult_filterEnvironments_tenantIDFail","Test_filterNodesToSearchResult_filterEnvironments_tenantIDFail"
"","2000","hides the password field and removes the requirement when logged in with SSO","Users","Fri Mar 27 01:56:33 UTC 2026","passed","Fri Mar 27 01:56:35 UTC 2026","","","",""
"","219","handles chevron click event","CommonSearches","Fri Mar 27 01:55:50 UTC 2026","passed","Fri Mar 27 01:55:50 UTC 2026","","","",""
"Test cases for TestManagementResource_ListSAMLProviders","7","TestManagementResource_ListSAMLProviders","","Fri Mar 27 01:54:25 UTC 2026","passed","Fri Mar 27 01:54:25 UTC 2026","","Go Test","github.com/specterops/bloodhound/cmd/api/src/api/v2/auth/TestManagementResource_ListSAMLProviders","TestManagementResource_ListSAMLProviders"
"Test cases for TestUpdateAssetGroupRequest_AuditData","0","TestUpdateAssetGroupRequest_AuditData","","Fri Mar 27 01:53:47 UTC 2026","passed","Fri Mar 27 01:53:47 UTC 2026","","Go Test","github.com/specterops/bloodhound/cmd/api/src/api/v2/TestUpdateAssetGroupRequest_AuditData","TestUpdateAssetGroupRequest_AuditData"
"","312","should render an SavedQueryPermissions component","SaveQueryDialog","Fri Mar 27 01:54:50 UTC 2026","passed","Fri Mar 27 01:54:51 UTC 2026","","","",""
"","9","uses the discardQueryParams prop to discard all query params on the redirect","AppNavigate","Fri Mar 27 01:58:05 UTC 2026","passed","Fri Mar 27 01:58:05 UTC 2026","","","",""
