"DESCRIPTION","DURATION IN MS","NAME","PARENT SUITE","START TIME","STATUS","STOP TIME","SUB SUITE","SUITE","TEST CLASS","TEST METHOD"
"Test cases for TestResources_UpdateSavedQuery_NoQueryMatch","1","TestResources_UpdateSavedQuery_NoQueryMatch","","Fri Mar 27 01:53:47 UTC 2026","passed","Fri Mar 27 01:53:47 UTC 2026","","Go Test","github.com/specterops/bloodhound/cmd/api/src/api/v2/TestResources_UpdateSavedQuery_NoQueryMatch","TestResources_UpdateSavedQuery_NoQueryMatch"
"Test cases for TestManagementResource_ListRoles_Filtered","0","TestManagementResource_ListRoles_Filtered","","Fri Mar 27 01:53:53 UTC 2026","passed","Fri Mar 27 01:53:53 UTC 2026","","Go Test","github.com/specterops/bloodhound/cmd/api/src/api/v2/auth/TestManagementResource_ListRoles_Filtered","TestManagementResource_ListRoles_Filtered"
"Test cases for TestResources_GetAssetGroupTagSelectors","1","TestResources_GetAssetGroupTagSelectors","","Fri Mar 27 01:53:47 UTC 2026","passed","Fri Mar 27 01:53:47 UTC 2026","","Go Test","github.com/specterops/bloodhound/cmd/api/src/api/v2/TestResources_GetAssetGroupTagSelectors","TestResources_GetAssetGroupTagSelectors"
"","403","sets exploreSearchTab param to pathfinding when the user clicks the `pathfinding` tab","ExploreSearch sets searchType on tab changing","Fri Mar 27 01:59:50 UTC 2026","passed","Fri Mar 27 01:59:50 UTC 2026","","","",""
"Test cases for TestResources_ListADDomainContainedGPOs","0","TestResources_ListADDomainContainedGPOs","","Fri Mar 27 01:53:47 UTC 2026","passed","Fri Mar 27 01:53:47 UTC 2026","","Go Test","github.com/specterops/bloodhound/cmd/api/src/api/v2/TestResources_ListADDomainContainedGPOs","TestResources_ListADDomainContainedGPOs"
"","1817","should open edge filtering dialog","EdgeFilter","Fri Mar 27 01:56:58 UTC 2026","passed","Fri Mar 27 01:56:59 UTC 2026","","","",""
"","129","returns a nodes array","useEdgeInfoItems","Fri Mar 27 01:57:35 UTC 2026","passed","Fri Mar 27 01:57:35 UTC 2026","","","",""
"","404","should not call onSave when Save button is clicked and form input is invalid","CreateUserDialog","Fri Mar 27 01:55:16 UTC 2026","passed","Fri Mar 27 01:55:17 UTC 2026","","","",""
"Test cases for TestResources_GetShortestPath","6","TestResources_GetShortestPath","","Fri Mar 27 01:53:47 UTC 2026","passed","Fri Mar 27 01:53:47 UTC 2026","","Go Test","github.com/specterops/bloodhound/cmd/api/src/api/v2/TestResources_GetShortestPath","TestResources_GetShortestPath"
"Test cases for TestManagementResource_OIDCLoginHandler","12","TestManagementResource_OIDCLoginHandler","","Fri Mar 27 01:54:25 UTC 2026","passed","Fri Mar 27 01:54:25 UTC 2026","","Go Test","github.com/specterops/bloodhound/cmd/api/src/api/v2/auth/TestManagementResource_OIDCLoginHandler","TestManagementResource_OIDCLoginHandler"
"","0","An unknown error occurred when fetching the data","Getting the text for the disabled item display for a search when there are no results","Fri Mar 27 01:57:19 UTC 2026","passed","Fri Mar 27 01:57:19 UTC 2026","","Error states","",""
"","9","sets autoDisplayTable to false if query type is node","useExploreTableAutoDisplay","Fri Mar 27 01:58:19 UTC 2026","passed","Fri Mar 27 01:58:19 UTC 2026","","","",""
"","38","upon selecting a source and destination node, updates the URL with a searchType of 'pathfinding' and the object ids for the source and destination nodes","usePathfindingSearch","Fri Mar 27 01:56:54 UTC 2026","passed","Fri Mar 27 01:56:54 UTC 2026","","","",""
"Test cases for TestResources_ListUsersMinimal","5","TestResources_ListUsersMinimal","","Fri Mar 27 01:54:25 UTC 2026","passed","Fri Mar 27 01:54:25 UTC 2026","","Go Test","github.com/specterops/bloodhound/cmd/api/src/api/v2/auth/TestResources_ListUsersMinimal","TestResources_ListUsersMinimal"
"","252","navigates to all rules when clicking ""All Rules""","RulesAccordion","Fri Mar 27 01:57:24 UTC 2026","passed","Fri Mar 27 01:57:24 UTC 2026","","","",""
"","0","abbreviates thousands, millions, billions, trillions as expected","numberFormatting","Fri Mar 27 01:57:14 UTC 2026","passed","Fri Mar 27 01:57:14 UTC 2026","","","",""
"Test cases for TestResources_ListADUserSQLAdminRights","1","TestResources_ListADUserSQLAdminRights","","Fri Mar 27 01:53:47 UTC 2026","passed","Fri Mar 27 01:53:47 UTC 2026","","Go Test","github.com/specterops/bloodhound/cmd/api/src/api/v2/TestResources_ListADUserSQLAdminRights","TestResources_ListADUserSQLAdminRights"
"","0","reports a Cypher-specific error when ruleType is SeedTypeCypher and seeds are required","handleError","Fri Mar 27 01:55:29 UTC 2026","passed","Fri Mar 27 01:55:29 UTC 2026","","","",""
"","1","prevents MouseCoords events","preventAllDefaults","Fri Mar 27 02:00:30 UTC 2026","passed","Fri Mar 27 02:00:30 UTC 2026","","","",""
"Test cases for TestResources_GetAIACAEntityInfo","227","TestResources_GetAIACAEntityInfo","","Fri Mar 27 01:53:47 UTC 2026","passed","Fri Mar 27 01:53:47 UTC 2026","","Go Test","github.com/specterops/bloodhound/cmd/api/src/api/v2/TestResources_GetAIACAEntityInfo","TestResources_GetAIACAEntityInfo"
"","46","should should reflect the NOT checked state for public query","SavedQueryPermissions","Fri Mar 27 01:57:41 UTC 2026","passed","Fri Mar 27 01:57:41 UTC 2026","","","",""
"","357","renders an empty message for the entity panel before a node is selected","GroupManagement","Fri Mar 27 02:00:08 UTC 2026","passed","Fri Mar 27 02:00:08 UTC 2026","","","",""
"Test cases for TestManagementResource_UpdateUser_UserSelfModify","983","TestManagementResource_UpdateUser_UserSelfModify","","Fri Mar 27 01:54:05 UTC 2026","passed","Fri Mar 27 01:54:06 UTC 2026","","Go Test","github.com/specterops/bloodhound/cmd/api/src/api/v2/auth/TestManagementResource_UpdateUser_UserSelfModify","TestManagementResource_UpdateUser_UserSelfModify"
"Test cases for TestIngestJobs_IsSortable","0","TestIngestJobs_IsSortable","","Fri Mar 27 01:53:49 UTC 2026","passed","Fri Mar 27 01:53:49 UTC 2026","","Go Test","github.com/specterops/bloodhound/cmd/api/src/model/TestIngestJobs_IsSortable","TestIngestJobs_IsSortable"
"","610","should render inputs, labels, and action buttons","UpsertSAMLProviderForm","Fri Mar 27 01:58:08 UTC 2026","passed","Fri Mar 27 01:58:09 UTC 2026","","","",""
"","166","should fire Cancel once with false","ConfirmationDialog","Fri Mar 27 01:59:09 UTC 2026","passed","Fri Mar 27 01:59:09 UTC 2026","","","",""
"Test cases for TestUnmarshalString","0","TestUnmarshalString","","Fri Mar 27 01:53:49 UTC 2026","passed","Fri Mar 27 01:53:49 UTC 2026","","Go Test","github.com/specterops/bloodhound/cmd/api/src/database/types/null/TestUnmarshalString","TestUnmarshalString"
"","0","should hide/expand search widget when user clicks minus/plus button","ExploreSearch rendering per tab","Fri Mar 27 02:00:32 UTC 2026","unknown","Fri Mar 27 02:00:32 UTC 2026","","","",""
"","155","renders enabled Zone and Rule tabs and disabled Object tab","Selected Details Tabs","Fri Mar 27 01:56:26 UTC 2026","passed","Fri Mar 27 01:56:26 UTC 2026","","Selected Details Tabs - Params present","",""
"","53","displays no data message when there are no extensions","ActiveExtensionsCard","Fri Mar 27 01:55:06 UTC 2026","passed","Fri Mar 27 01:55:06 UTC 2026","","","",""
"Test cases for TestCacheEntryDigester_DigestEndpoint_DefaultObjectID","0","TestCacheEntryDigester_DigestEndpoint_DefaultObjectID","","Fri Mar 27 01:53:52 UTC 2026","passed","Fri Mar 27 01:53:52 UTC 2026","","Go Test","github.com/specterops/bloodhound/cmd/api/src/services/graphify/endpoint/TestCacheEntryDigester_DigestEndpoint_DefaultObjectID","TestCacheEntryDigester_DigestEndpoint_DefaultObjectID"
"","1185","should display all available SSO providers","CreateUserDialog","Fri Mar 27 01:55:18 UTC 2026","passed","Fri Mar 27 01:55:20 UTC 2026","","","",""
"Test cases for TestBuildErrorResponseDefault","0","TestBuildErrorResponseDefault","","Fri Mar 27 01:53:37 UTC 2026","passed","Fri Mar 27 01:53:37 UTC 2026","","Go Test","github.com/specterops/bloodhound/cmd/api/src/api/TestBuildErrorResponseDefault","TestBuildErrorResponseDefault"
"","39","upon selecting just a destination node, updates the URL with a searchType of 'node' and secondarySearch of the node's objectid","usePathfindingSearch","Fri Mar 27 01:56:54 UTC 2026","passed","Fri Mar 27 01:56:54 UTC 2026","","","",""
"Test cases for TestLoginExpiry","0","TestLoginExpiry","","Fri Mar 27 01:54:25 UTC 2026","passed","Fri Mar 27 01:54:25 UTC 2026","","Go Test","github.com/specterops/bloodhound/cmd/api/src/api/v2/auth/TestLoginExpiry","TestLoginExpiry"
"","0","Input does not contain a type","Parsing the debounced input for type and keyword values","Fri Mar 27 01:57:19 UTC 2026","passed","Fri Mar 27 01:57:19 UTC 2026","","","",""
"","0","returns disabled config when any required param is falsey","useExploreGraph","Fri Mar 27 01:56:12 UTC 2026","passed","Fri Mar 27 01:56:12 UTC 2026","composition search queries","exploreGraphQueryFactory","",""
"","28","returns numbers as strings","numberFormatting","Fri Mar 27 01:57:14 UTC 2026","passed","Fri Mar 27 01:57:14 UTC 2026","","","",""
"","1273","when user performs a pathfinding search, the selection for the start node is carried over to the `search` tab","ExploreSearch interaction","Fri Mar 27 01:59:52 UTC 2026","passed","Fri Mar 27 01:59:54 UTC 2026","","","",""
"Test cases for TestManagementResource_DeleteUser_UserBhCtxNotFound","0","TestManagementResource_DeleteUser_UserBhCtxNotFound","","Fri Mar 27 01:54:09 UTC 2026","passed","Fri Mar 27 01:54:09 UTC 2026","","Go Test","github.com/specterops/bloodhound/cmd/api/src/api/v2/auth/TestManagementResource_DeleteUser_UserBhCtxNotFound","TestManagementResource_DeleteUser_UserBhCtxNotFound"
"","329","renders icons as expected","DropdownSelector","Fri Mar 27 01:58:10 UTC 2026","passed","Fri Mar 27 01:58:10 UTC 2026","","","",""
"","115","should display the logged in user's email address","UserProfile","Fri Mar 27 01:56:07 UTC 2026","passed","Fri Mar 27 01:56:07 UTC 2026","","","",""
"","194","calls setExploreParams with searchType and relationshipQueryItemId when selecting a composition accordion","EdgeInfoContent","Fri Mar 27 01:55:06 UTC 2026","passed","Fri Mar 27 01:55:06 UTC 2026","","EdgeInfoContent support for Deep Linking","",""
"","3","shows the collection methods for the given job","toCollected","Fri Mar 27 01:58:56 UTC 2026","passed","Fri Mar 27 01:58:56 UTC 2026","","","",""
"","61","excludes API edges that are associated with one of our built-in schema types","useEdgeCategories","Fri Mar 27 01:56:01 UTC 2026","passed","Fri Mar 27 01:56:01 UTC 2026","","","",""
"Test cases for TestResources_CreateSavedQuery","0","TestResources_CreateSavedQuery","","Fri Mar 27 01:53:47 UTC 2026","passed","Fri Mar 27 01:53:47 UTC 2026","","Go Test","github.com/specterops/bloodhound/cmd/api/src/api/v2/TestResources_CreateSavedQuery","TestResources_CreateSavedQuery"
"","765","calls the passed in select handler when clicking the Confirm button","Glyph Select Dialog","Fri Mar 27 01:58:57 UTC 2026","passed","Fri Mar 27 01:58:58 UTC 2026","","","",""
"Test cases for TestManagementResource_ListAuthTokens_DBError","0","TestManagementResource_ListAuthTokens_DBError","","Fri Mar 27 01:54:15 UTC 2026","passed","Fri Mar 27 01:54:15 UTC 2026","","Go Test","github.com/specterops/bloodhound/cmd/api/src/api/v2/auth/TestManagementResource_ListAuthTokens_DBError","TestManagementResource_ListAuthTokens_DBError"
"Test cases for TestMatches_FailureStatus","1","TestMatches_FailureStatus","","Fri Mar 27 01:53:49 UTC 2026","passed","Fri Mar 27 01:53:49 UTC 2026","","Go Test","github.com/specterops/bloodhound/cmd/api/src/model/TestMatches_FailureStatus","TestMatches_FailureStatus"
"","305","should render with the correct content","ConfirmUpdateQueryDialog","Fri Mar 27 01:58:57 UTC 2026","passed","Fri Mar 27 01:58:58 UTC 2026","","","",""
"","235","toggles sort order when clicking sortable header","RulesAccordion","Fri Mar 27 01:57:24 UTC 2026","passed","Fri Mar 27 01:57:24 UTC 2026","","","",""
"","112","Calls the `Base` endpoint for a LocalUser type node","EntityObjectInformation","Fri Mar 27 01:57:04 UTC 2026","passed","Fri Mar 27 01:57:04 UTC 2026","","","",""
"Test cases for TestOrphanFileSweeper_Clear","2","TestOrphanFileSweeper_Clear","","Fri Mar 27 01:53:48 UTC 2026","passed","Fri Mar 27 01:53:48 UTC 2026","","Go Test","github.com/specterops/bloodhound/cmd/api/src/daemons/datapipe/TestOrphanFileSweeper_Clear","TestOrphanFileSweeper_Clear"
"Test cases for TestResources_DeleteSavedQuery_IsPublicSavedQueryDBError","0","TestResources_DeleteSavedQuery_IsPublicSavedQueryDBError","","Fri Mar 27 01:53:47 UTC 2026","passed","Fri Mar 27 01:53:47 UTC 2026","","Go Test","github.com/specterops/bloodhound/cmd/api/src/api/v2/TestResources_DeleteSavedQuery_IsPublicSavedQueryDBError","TestResources_DeleteSavedQuery_IsPublicSavedQueryDBError"
"","0","should ignore case when filtering","OperationsFilterPlugin","Fri Mar 27 01:59:25 UTC 2026","passed","Fri Mar 27 01:59:25 UTC 2026","","","",""
"","4","returns true if arrays are referentially equal","areArraysSimilar","Fri Mar 27 01:58:59 UTC 2026","passed","Fri Mar 27 01:58:59 UTC 2026","","","",""
"","43","should have a .z-nav class","MainNav","Fri Mar 27 01:55:29 UTC 2026","passed","Fri Mar 27 01:55:29 UTC 2026","","","",""
"","0","returns false if arrays have different length","areArraysSimilar","Fri Mar 27 01:58:59 UTC 2026","passed","Fri Mar 27 01:58:59 UTC 2026","","","",""
"","65","returns the full environment for the environmentid passed","useAvailableEnvironments","Fri Mar 27 01:58:25 UTC 2026","passed","Fri Mar 27 01:58:25 UTC 2026","","useSelectedEnvironment","",""
"Test cases for Test_filterNodesToSearchResult_filterEnvironments","0","Test_filterNodesToSearchResult_filterEnvironments","","Fri Mar 27 01:53:51 UTC 2026","passed","Fri Mar 27 01:53:51 UTC 2026","","Go Test","github.com/specterops/bloodhound/cmd/api/src/queries/Test_filterNodesToSearchResult_filterEnvironments","Test_filterNodesToSearchResult_filterEnvironments"
"","371","should display a ""Configure Multi-Factor Authentication"" modal","UserProfile","Fri Mar 27 01:56:08 UTC 2026","passed","Fri Mar 27 01:56:09 UTC 2026","","""Multi-Factor Authentication Enabled"" switch is enabled","",""
"","873","should not have less characters than the minimum requirement","CreateUserForm","Fri Mar 27 01:55:23 UTC 2026","passed","Fri Mar 27 01:55:24 UTC 2026","","","",""
"Test cases for TestAggregator_Impact","0","TestAggregator_Impact","","Fri Mar 27 01:54:07 UTC 2026","passed","Fri Mar 27 01:54:07 UTC 2026","","Go Test","github.com/specterops/bloodhound/packages/go/analysis/impact/TestAggregator_Impact","TestAggregator_Impact"
"","55","should render oidc info provider","SSOProviderTable","Fri Mar 27 01:57:51 UTC 2026","passed","Fri Mar 27 01:57:51 UTC 2026","","","",""
"Test cases for TestWriteBasicResponse","2","TestWriteBasicResponse","","Fri Mar 27 01:53:37 UTC 2026","passed","Fri Mar 27 01:53:37 UTC 2026","","Go Test","github.com/specterops/bloodhound/cmd/api/src/api/TestWriteBasicResponse","TestWriteBasicResponse"
"","0","returns disabled config when any required param is falsey","useExploreGraph","Fri Mar 27 01:56:12 UTC 2026","passed","Fri Mar 27 01:56:12 UTC 2026","relationship search queries","exploreGraphQueryFactory","",""
"","8","does not render note content when selected is null","HistoryNotes Component","Fri Mar 27 01:59:04 UTC 2026","passed","Fri Mar 27 01:59:04 UTC 2026","","","",""
"Test cases for TestSavedQueries_ValidFilters","0","TestSavedQueries_ValidFilters","","Fri Mar 27 01:53:49 UTC 2026","passed","Fri Mar 27 01:53:49 UTC 2026","","Go Test","github.com/specterops/bloodhound/cmd/api/src/model/TestSavedQueries_ValidFilters","TestSavedQueries_ValidFilters"
"","1","lastlogon, lastlogontimestamp","Handling value formatting for Active Directory entity properties lastlogon, lastlogontimestamp, whencreated, and pwdlastset","Fri Mar 27 01:55:52 UTC 2026","passed","Fri Mar 27 01:55:52 UTC 2026","","","",""
"","9","sets autoDisplayTable to false if query type is pathfinding","useExploreTableAutoDisplay","Fri Mar 27 01:58:19 UTC 2026","passed","Fri Mar 27 01:58:19 UTC 2026","","","",""
"","6","safely handles removing nonexistent key","useObjectState","Fri Mar 27 01:58:37 UTC 2026","passed","Fri Mar 27 01:58:37 UTC 2026","","","",""
"","14","renders note content when currentNote is present","HistoryNotes Component","Fri Mar 27 01:59:04 UTC 2026","passed","Fri Mar 27 01:59:04 UTC 2026","","","",""
"Test cases for TestResources_ListADCSEscalations","0","TestResources_ListADCSEscalations","","Fri Mar 27 01:53:47 UTC 2026","passed","Fri Mar 27 01:53:47 UTC 2026","","Go Test","github.com/specterops/bloodhound/cmd/api/src/api/v2/TestResources_ListADCSEscalations","TestResources_ListADCSEscalations"
"","1","returns a function that can set arrays query params removes previous values set to that array query param","searchParams","Fri Mar 27 01:57:49 UTC 2026","passed","Fri Mar 27 01:57:49 UTC 2026","","setSingleParamFactory","",""
"","9","optionally allows the consumer to pass a query to performSearch() and adds that query to the url","useCypherSearch","Fri Mar 27 01:58:54 UTC 2026","passed","Fri Mar 27 01:58:54 UTC 2026","","","",""
"","416","has user filters","FileIngestFilterDialog","Fri Mar 27 01:55:37 UTC 2026","passed","Fri Mar 27 01:55:37 UTC 2026","","User Select","",""
"","91","applies correct dynamic height based on filtered data","ActiveExtensionsCard","Fri Mar 27 01:55:07 UTC 2026","passed","Fri Mar 27 01:55:07 UTC 2026","","","",""
"Test cases for TestManagementResource_ListPermissions_PredicateMismatchWithColumn","0","TestManagementResource_ListPermissions_PredicateMismatchWithColumn","","Fri Mar 27 01:53:53 UTC 2026","passed","Fri Mar 27 01:53:53 UTC 2026","","Go Test","github.com/specterops/bloodhound/cmd/api/src/api/v2/auth/TestManagementResource_ListPermissions_PredicateMismatchWithColumn","TestManagementResource_ListPermissions_PredicateMismatchWithColumn"
"Test cases for TestResources_StartIngestJob","82","TestResources_StartIngestJob","","Fri Mar 27 01:53:47 UTC 2026","passed","Fri Mar 27 01:53:47 UTC 2026","","Go Test","github.com/specterops/bloodhound/cmd/api/src/api/v2/TestResources_StartIngestJob","TestResources_StartIngestJob"
"","7","displays lastlogontimestamp cell as NEVER when the value is -1","ExploreTableDataCell","Fri Mar 27 01:58:39 UTC 2026","passed","Fri Mar 27 01:58:39 UTC 2026","","","",""
"","216","Displays a notification when analysis has been requested successfully","AnalyzeNowConfiguration","Fri Mar 27 01:56:19 UTC 2026","passed","Fri Mar 27 01:56:19 UTC 2026","","","",""
"","764","renders a link to the explore page when member is clicked","GroupManagement","Fri Mar 27 02:00:09 UTC 2026","passed","Fri Mar 27 02:00:10 UTC 2026","","","",""
"","259","Selecting an edge that meets ACL inheritance criteria shows the ""ACE Inherited From"" dropdown","EdgeInfoContent","Fri Mar 27 01:55:05 UTC 2026","passed","Fri Mar 27 01:55:06 UTC 2026","","","",""
"Test cases for TestResources_ListEdgeTypes","105","TestResources_ListEdgeTypes","","Fri Mar 27 01:53:47 UTC 2026","passed","Fri Mar 27 01:53:47 UTC 2026","","Go Test","github.com/specterops/bloodhound/cmd/api/src/api/v2/TestResources_ListEdgeTypes","TestResources_ListEdgeTypes"
"Test cases for TestManagementResource_SAMLCallbackHandler","8","TestManagementResource_SAMLCallbackHandler","","Fri Mar 27 01:54:25 UTC 2026","passed","Fri Mar 27 01:54:25 UTC 2026","","Go Test","github.com/specterops/bloodhound/cmd/api/src/api/v2/auth/TestManagementResource_SAMLCallbackHandler","TestManagementResource_SAMLCallbackHandler"
"","0","The data is fetching","Getting the text for the disabled item display for a search when there are no results","Fri Mar 27 01:57:19 UTC 2026","passed","Fri Mar 27 01:57:19 UTC 2026","","Loading states","",""
"Test cases for TestServeHTTP_Success","0","TestServeHTTP_Success","","Fri Mar 27 01:53:40 UTC 2026","passed","Fri Mar 27 01:53:40 UTC 2026","","Go Test","github.com/specterops/bloodhound/cmd/api/src/api/middleware/TestServeHTTP_Success","TestServeHTTP_Success"
"Test cases for TestResources_GetOUEntityInfo","0","TestResources_GetOUEntityInfo","","Fri Mar 27 01:53:47 UTC 2026","passed","Fri Mar 27 01:53:47 UTC 2026","","Go Test","github.com/specterops/bloodhound/cmd/api/src/api/v2/TestResources_GetOUEntityInfo","TestResources_GetOUEntityInfo"
"","284","sets a secondary=id and searchType=pathfinding when primary is truethy","ContextMenu","Fri Mar 27 01:55:37 UTC 2026","passed","Fri Mar 27 01:55:37 UTC 2026","","","",""
"","3557","Typing in the search bar filters the results","ExploreTable","Fri Mar 27 01:54:46 UTC 2026","passed","Fri Mar 27 01:54:50 UTC 2026","","","",""
"","37","sets input text to value","ManagedDatePicker - value","Fri Mar 27 01:57:04 UTC 2026","passed","Fri Mar 27 01:57:04 UTC 2026","","","",""
"Test cases for Test_filterNodesToSearchResult_filterEnvironmentsOG","0","Test_filterNodesToSearchResult_filterEnvironmentsOG","","Fri Mar 27 01:53:51 UTC 2026","passed","Fri Mar 27 01:53:51 UTC 2026","","Go Test","github.com/specterops/bloodhound/cmd/api/src/queries/Test_filterNodesToSearchResult_filterEnvironmentsOG","Test_filterNodesToSearchResult_filterEnvironmentsOG"
"Test cases for TestConvertAzureRoleEligibilityScheduleInstanceToRel","0","TestConvertAzureRoleEligibilityScheduleInstanceToRel","","Fri Mar 27 01:54:07 UTC 2026","passed","Fri Mar 27 01:54:07 UTC 2026","","Go Test","github.com/specterops/bloodhound/packages/go/ein/TestConvertAzureRoleEligibilityScheduleInstanceToRel","TestConvertAzureRoleEligibilityScheduleInstanceToRel"
"Test cases for FuzzFoldlLazy","0","FuzzFoldlLazy","","Fri Mar 27 01:54:08 UTC 2026","passed","Fri Mar 27 01:54:08 UTC 2026","","Go Test","github.com/specterops/bloodhound/packages/go/slicesext/FuzzFoldlLazy","FuzzFoldlLazy"
"","893","should render","CypherSearch","Fri Mar 27 01:57:10 UTC 2026","passed","Fri Mar 27 01:57:11 UTC 2026","","","",""
"","374","Should call handler when a member is clicked","AssetGroupMemberList","Fri Mar 27 01:58:35 UTC 2026","passed","Fri Mar 27 01:58:35 UTC 2026","","","",""
"Test cases for TestEncodingEquality","0","TestEncodingEquality","","Fri Mar 27 01:54:07 UTC 2026","passed","Fri Mar 27 01:54:07 UTC 2026","","Go Test","github.com/specterops/bloodhound/packages/go/bomenc/TestEncodingEquality","TestEncodingEquality"
"","181","renders with a title","BloodHoundConfiguration","Fri Mar 27 02:00:31 UTC 2026","passed","Fri Mar 27 02:00:31 UTC 2026","","","",""
"Test cases for TestResources_ToggleFlag","0","TestResources_ToggleFlag","","Fri Mar 27 01:53:47 UTC 2026","passed","Fri Mar 27 01:53:47 UTC 2026","","Go Test","github.com/specterops/bloodhound/cmd/api/src/api/v2/TestResources_ToggleFlag","TestResources_ToggleFlag"
"Test cases for TestResources_ListADGroupMembership","0","TestResources_ListADGroupMembership","","Fri Mar 27 01:53:47 UTC 2026","passed","Fri Mar 27 01:53:47 UTC 2026","","Go Test","github.com/specterops/bloodhound/cmd/api/src/api/v2/TestResources_ListADGroupMembership","TestResources_ListADGroupMembership"
"","127","buttons are disabled while loading","OneTimePasscodeForm","Fri Mar 27 01:58:32 UTC 2026","passed","Fri Mar 27 01:58:32 UTC 2026","","","",""
"Test cases for TestManagementResource_SAMLCallbackRedirect","7","TestManagementResource_SAMLCallbackRedirect","","Fri Mar 27 01:54:25 UTC 2026","passed","Fri Mar 27 01:54:25 UTC 2026","","Go Test","github.com/specterops/bloodhound/cmd/api/src/api/v2/auth/TestManagementResource_SAMLCallbackRedirect","TestManagementResource_SAMLCallbackRedirect"
"","9","should render a Field when the provided value is -0","Field","Fri Mar 27 01:58:50 UTC 2026","passed","Fri Mar 27 01:58:50 UTC 2026","","","",""
"","38","does not set input text if no value is given","ManagedDatePicker - value","Fri Mar 27 01:57:04 UTC 2026","passed","Fri Mar 27 01:57:04 UTC 2026","","","",""
"Test cases for TestToolContainer_GetScheduledAnalysisConfiguration_Errors","1","TestToolContainer_GetScheduledAnalysisConfiguration_Errors","","Fri Mar 27 01:53:40 UTC 2026","passed","Fri Mar 27 01:53:40 UTC 2026","","Go Test","github.com/specterops/bloodhound/cmd/api/src/api/tools/TestToolContainer_GetScheduledAnalysisConfiguration_Errors","TestToolContainer_GetScheduledAnalysisConfiguration_Errors"
"Test cases for TestParseUserIP_RemoteAddrOnly","0","TestParseUserIP_RemoteAddrOnly","","Fri Mar 27 01:53:40 UTC 2026","passed","Fri Mar 27 01:53:40 UTC 2026","","Go Test","github.com/specterops/bloodhound/cmd/api/src/api/middleware/TestParseUserIP_RemoteAddrOnly","TestParseUserIP_RemoteAddrOnly"
"","285","does not render an edit form for the selected asset group when a user does not have graph write permissions","GroupManagement","Fri Mar 27 02:00:07 UTC 2026","passed","Fri Mar 27 02:00:07 UTC 2026","","","",""
"Test cases for TestWriteAndValidateZip","0","TestWriteAndValidateZip","","Fri Mar 27 01:53:53 UTC 2026","passed","Fri Mar 27 01:53:53 UTC 2026","","Go Test","github.com/specterops/bloodhound/cmd/api/src/services/upload/TestWriteAndValidateZip","TestWriteAndValidateZip"
"Test cases for TestFloatInfNaN","0","TestFloatInfNaN","","Fri Mar 27 01:53:49 UTC 2026","passed","Fri Mar 27 01:53:49 UTC 2026","","Go Test","github.com/specterops/bloodhound/cmd/api/src/database/types/null/TestFloatInfNaN","TestFloatInfNaN"
"","10","keeps callbacks stable across renders","useObjectState","Fri Mar 27 01:58:37 UTC 2026","passed","Fri Mar 27 01:58:37 UTC 2026","","","",""
"Test cases for TestResources_ListADDomainContainedUsers","0","TestResources_ListADDomainContainedUsers","","Fri Mar 27 01:53:47 UTC 2026","passed","Fri Mar 27 01:53:47 UTC 2026","","Go Test","github.com/specterops/bloodhound/cmd/api/src/api/v2/TestResources_ListADDomainContainedUsers","TestResources_ListADDomainContainedUsers"
