"DESCRIPTION","DURATION IN MS","NAME","PARENT SUITE","START TIME","STATUS","STOP TIME","SUB SUITE","SUITE","TEST CLASS","TEST METHOD"
"","1","filters by active-directory platform","filterAndSearchEnvironments","Fri Jul 10 19:23:15 UTC 2026","passed","Fri Jul 10 19:23:15 UTC 2026","","platform filters","",""
"Test cases for TestResources_UpdateSavedQuery_NoQueryMatch","0","TestResources_UpdateSavedQuery_NoQueryMatch","","Fri Jul 10 19:21:59 UTC 2026","passed","Fri Jul 10 19:21:59 UTC 2026","","Go Test","github.com/specterops/bloodhound/cmd/api/src/api/v2/TestResources_UpdateSavedQuery_NoQueryMatch","TestResources_UpdateSavedQuery_NoQueryMatch"
"","108","indicates that filters are inactive","AssetGroupEdit","Fri Jul 10 19:25:16 UTC 2026","passed","Fri Jul 10 19:25:17 UTC 2026","","","",""
"","0","returns Object ID message when ruleType is SeedTypeObjectId and seeds are required","getErrorMessage","Fri Jul 10 19:24:34 UTC 2026","passed","Fri Jul 10 19:24:34 UTC 2026","","","",""
"Test cases for TestResources_ListADComputerSessions","0","TestResources_ListADComputerSessions","","Fri Jul 10 19:21:59 UTC 2026","passed","Fri Jul 10 19:21:59 UTC 2026","","Go Test","github.com/specterops/bloodhound/cmd/api/src/api/v2/TestResources_ListADComputerSessions","TestResources_ListADComputerSessions"
"","315","calls onChangePinnedColumns with DEFAULT_PINNED_COLUMN_KEYS when ""Reset Default"" is clicked","ManageColumnsComboBox","Fri Jul 10 19:25:08 UTC 2026","passed","Fri Jul 10 19:25:08 UTC 2026","","","",""
"Test cases for TestManagementResource_ListPermissions_SortingError","0","TestManagementResource_ListPermissions_SortingError","","Fri Jul 10 19:22:05 UTC 2026","passed","Fri Jul 10 19:22:05 UTC 2026","","Go Test","github.com/specterops/bloodhound/cmd/api/src/api/v2/auth/TestManagementResource_ListPermissions_SortingError","TestManagementResource_ListPermissions_SortingError"
"Test cases for TestIsValidClientVersion","0","TestIsValidClientVersion","","Fri Jul 10 19:22:26 UTC 2026","passed","Fri Jul 10 19:22:26 UTC 2026","","Go Test","github.com/specterops/bloodhound/cmd/api/src/utils/TestIsValidClientVersion","TestIsValidClientVersion"
"Test cases for TestDisenrollMFA_Failure","0","TestDisenrollMFA_Failure","","Fri Jul 10 19:22:31 UTC 2026","passed","Fri Jul 10 19:22:31 UTC 2026","","Go Test","github.com/specterops/bloodhound/cmd/api/src/api/v2/auth/TestDisenrollMFA_Failure","TestDisenrollMFA_Failure"
"Test cases for Test_filterAndFormatSearchResults_filterEnvironments_tenantIDFail","0","Test_filterAndFormatSearchResults_filterEnvironments_tenantIDFail","","Fri Jul 10 19:21:59 UTC 2026","passed","Fri Jul 10 19:21:59 UTC 2026","","Go Test","github.com/specterops/bloodhound/cmd/api/src/api/v2/Test_filterAndFormatSearchResults_filterEnvironments_tenantIDFail","Test_filterAndFormatSearchResults_filterEnvironments_tenantIDFail"
"Test cases for TestResources_UpdateSavedQuery_Admin_NonPublicQuery","0","TestResources_UpdateSavedQuery_Admin_NonPublicQuery","","Fri Jul 10 19:21:59 UTC 2026","passed","Fri Jul 10 19:21:59 UTC 2026","","Go Test","github.com/specterops/bloodhound/cmd/api/src/api/v2/TestResources_UpdateSavedQuery_Admin_NonPublicQuery","TestResources_UpdateSavedQuery_Admin_NonPublicQuery"
"","162","calls clickHandler when a line item is clicked","PrebuiltSearchList","Fri Jul 10 19:26:22 UTC 2026","passed","Fri Jul 10 19:26:22 UTC 2026","","","",""
"Test cases for TestHandlers_CreateRequest","1","TestHandlers_CreateRequest","","Fri Jul 10 19:22:50 UTC 2026","passed","Fri Jul 10 19:22:50 UTC 2026","","Go Test","github.com/specterops/bloodhound/server/analysis/internal/handlers/TestHandlers_CreateRequest","TestHandlers_CreateRequest"
"Test cases for TestStore_List","47","TestStore_List","","Fri Jul 10 19:22:48 UTC 2026","passed","Fri Jul 10 19:22:48 UTC 2026","","Go Test","github.com/specterops/bloodhound/packages/go/storage/TestStore_List","TestStore_List"
"Test cases for TestRoleAssignments_NodesWithRolesExclusive","0","TestRoleAssignments_NodesWithRolesExclusive","","Fri Jul 10 19:22:27 UTC 2026","passed","Fri Jul 10 19:22:27 UTC 2026","","Go Test","github.com/specterops/bloodhound/packages/go/analysis/azure/TestRoleAssignments_NodesWithRolesExclusive","TestRoleAssignments_NodesWithRolesExclusive"
"Test cases for TestWriteResultJson","0","TestWriteResultJson","","Fri Jul 10 19:22:26 UTC 2026","passed","Fri Jul 10 19:22:26 UTC 2026","","Go Test","github.com/specterops/bloodhound/cmd/api/src/utils/TestWriteResultJson","TestWriteResultJson"
"Test cases for TestParseDomainTrusts_TrustAttributes","1","TestParseDomainTrusts_TrustAttributes","","Fri Jul 10 19:22:27 UTC 2026","passed","Fri Jul 10 19:22:27 UTC 2026","","Go Test","github.com/specterops/bloodhound/packages/go/ein/TestParseDomainTrusts_TrustAttributes","TestParseDomainTrusts_TrustAttributes"
"","70","enables filtering out for tags that are treated as Labels (including Owned)","the useAssetGroupTags utilities","Fri Jul 10 19:25:01 UTC 2026","passed","Fri Jul 10 19:25:01 UTC 2026","","","",""
"","13","returns all collected environment ids associated to a given aggregation","getEnvironmentAggregationIds","Fri Jul 10 19:23:15 UTC 2026","passed","Fri Jul 10 19:23:15 UTC 2026","","","",""
"Test cases for TestConvertComputerToNode","0","TestConvertComputerToNode","","Fri Jul 10 19:22:27 UTC 2026","passed","Fri Jul 10 19:22:27 UTC 2026","","Go Test","github.com/specterops/bloodhound/packages/go/ein/TestConvertComputerToNode","TestConvertComputerToNode"
"","1","combines all filter types","filterAndSearchEnvironments","Fri Jul 10 19:23:15 UTC 2026","passed","Fri Jul 10 19:23:15 UTC 2026","","combined filters","",""
"","0","returns disabled if relationshipQueryItemId does not have a matching sourceId, edgeType, targetId","useExploreGraph","Fri Jul 10 19:24:32 UTC 2026","passed","Fri Jul 10 19:24:32 UTC 2026","composition search queries","exploreGraphQueryFactory","",""
"Test cases for Test_ConvertAzureRoleManagementPolicyAssignment","0","Test_ConvertAzureRoleManagementPolicyAssignment","","Fri Jul 10 19:22:27 UTC 2026","passed","Fri Jul 10 19:22:27 UTC 2026","","Go Test","github.com/specterops/bloodhound/packages/go/ein/Test_ConvertAzureRoleManagementPolicyAssignment","Test_ConvertAzureRoleManagementPolicyAssignment"
"","622","should not have less characters than the minimum requirement","UpdateUserForm","Fri Jul 10 19:23:01 UTC 2026","passed","Fri Jul 10 19:23:01 UTC 2026","","","",""
"","620","calls openSAMLProviderDialog when SAML Provider menu item is clicked","CreateMenu","Fri Jul 10 19:25:17 UTC 2026","passed","Fri Jul 10 19:25:17 UTC 2026","","oidc_support feature flag enabled","",""
"Test cases for TestResources_UpdateSavedQuery_InvalidID","0","TestResources_UpdateSavedQuery_InvalidID","","Fri Jul 10 19:21:59 UTC 2026","passed","Fri Jul 10 19:21:59 UTC 2026","","Go Test","github.com/specterops/bloodhound/cmd/api/src/api/v2/TestResources_UpdateSavedQuery_InvalidID","TestResources_UpdateSavedQuery_InvalidID"
"","1","should hide/expand search widget when user clicks minus/plus button","ExploreSearch rendering per tab","Fri Jul 10 19:30:12 UTC 2026","unknown","Fri Jul 10 19:30:12 UTC 2026","","","",""
"Test cases for TestRoleAssignments_NodesWithRole","0","TestRoleAssignments_NodesWithRole","","Fri Jul 10 19:22:27 UTC 2026","passed","Fri Jul 10 19:22:27 UTC 2026","","Go Test","github.com/specterops/bloodhound/packages/go/analysis/azure/TestRoleAssignments_NodesWithRole","TestRoleAssignments_NodesWithRole"
"Test cases for TestAuthExtensions","3","TestAuthExtensions","","Fri Jul 10 19:21:48 UTC 2026","passed","Fri Jul 10 19:21:48 UTC 2026","","Go Test","github.com/specterops/bloodhound/cmd/api/src/api/TestAuthExtensions","TestAuthExtensions"
"","0","No type was provided and no results were available","Getting the text for the disabled item display for a search when there are no results","Fri Jul 10 19:27:41 UTC 2026","passed","Fri Jul 10 19:27:41 UTC 2026","","Empty data states","",""
"","20","does not render the tooltip icon when tooltipText prop is not passed","ColumnHeaders","Fri Jul 10 19:26:16 UTC 2026","passed","Fri Jul 10 19:26:16 UTC 2026","","SortableHeader with Tooltip","",""
"","185","renders when all data is available and rule is not default","Delete Selector Button rendering","Fri Jul 10 19:28:23 UTC 2026","passed","Fri Jul 10 19:28:24 UTC 2026","","","",""
"","0","returns the distance between two coordinates","getDistanceBetween","Fri Jul 10 19:30:04 UTC 2026","passed","Fri Jul 10 19:30:04 UTC 2026","","","",""
"Test cases for TestAnalysisPipelineResultErrors","4","TestAnalysisPipelineResultErrors","","Fri Jul 10 19:22:26 UTC 2026","passed","Fri Jul 10 19:22:26 UTC 2026","","Go Test","github.com/specterops/bloodhound/packages/go/analysis/TestAnalysisPipelineResultErrors","TestAnalysisPipelineResultErrors"
"","88","should hide Environmental Targeted Access Control panel when showEnvironmentAccessControls prop is false","CreateUserForm","Fri Jul 10 19:23:33 UTC 2026","passed","Fri Jul 10 19:23:33 UTC 2026","","","",""
"","8694","filter selections are rolled back if user closes modal with the cancel button","EdgeFilter","Fri Jul 10 19:26:13 UTC 2026","passed","Fri Jul 10 19:26:21 UTC 2026","","","",""
"","300","displays 0 when a given sections returns empty, and sums the rest of the sections correctly","EntityInfoDataTableGraphed","Fri Jul 10 19:25:28 UTC 2026","passed","Fri Jul 10 19:25:28 UTC 2026","","Node count for nested table that counts all sections","",""
"Test cases for TestResources_ListADOUContainedGroups","1","TestResources_ListADOUContainedGroups","","Fri Jul 10 19:21:59 UTC 2026","passed","Fri Jul 10 19:21:59 UTC 2026","","Go Test","github.com/specterops/bloodhound/cmd/api/src/api/v2/TestResources_ListADOUContainedGroups","TestResources_ListADOUContainedGroups"
"Test cases for TestManagementResource_GetPermission","39719","TestManagementResource_GetPermission","","Fri Jul 10 19:22:05 UTC 2026","passed","Fri Jul 10 19:22:45 UTC 2026","","Go Test","github.com/specterops/bloodhound/cmd/api/src/api/v2/auth/TestManagementResource_GetPermission","TestManagementResource_GetPermission"
"Test cases for TestDispatchAnalysisSteps","4","TestDispatchAnalysisSteps","","Fri Jul 10 19:22:26 UTC 2026","passed","Fri Jul 10 19:22:26 UTC 2026","","Go Test","github.com/specterops/bloodhound/packages/go/analysis/TestDispatchAnalysisSteps","TestDispatchAnalysisSteps"
"Test cases for TestFormatDatabaseError","0","TestFormatDatabaseError","","Fri Jul 10 19:21:48 UTC 2026","passed","Fri Jul 10 19:21:48 UTC 2026","","Go Test","github.com/specterops/bloodhound/cmd/api/src/api/TestFormatDatabaseError","TestFormatDatabaseError"
"Test cases for TestGetLatestQueryParameter_LatestMalformed","1","TestGetLatestQueryParameter_LatestMalformed","","Fri Jul 10 19:21:59 UTC 2026","passed","Fri Jul 10 19:21:59 UTC 2026","","Go Test","github.com/specterops/bloodhound/cmd/api/src/api/v2/TestGetLatestQueryParameter_LatestMalformed","TestGetLatestQueryParameter_LatestMalformed"
"","132","Searching for existing node type returns node properties","useFetchEntityInfo","Fri Jul 10 19:26:07 UTC 2026","passed","Fri Jul 10 19:26:07 UTC 2026","","","",""
"Test cases for TestManagementResource_ListAuthTokens_UserIDFilter","6","TestManagementResource_ListAuthTokens_UserIDFilter","","Fri Jul 10 19:22:28 UTC 2026","passed","Fri Jul 10 19:22:28 UTC 2026","","Go Test","github.com/specterops/bloodhound/cmd/api/src/api/v2/auth/TestManagementResource_ListAuthTokens_UserIDFilter","TestManagementResource_ListAuthTokens_UserIDFilter"
"","729","should not allow the input to exceed the allowed length","CreateUserForm","Fri Jul 10 19:23:29 UTC 2026","passed","Fri Jul 10 19:23:30 UTC 2026","","","",""
"Test cases for Test_validateGraphExtension","3","Test_validateGraphExtension","","Fri Jul 10 19:22:04 UTC 2026","passed","Fri Jul 10 19:22:04 UTC 2026","","Go Test","github.com/specterops/bloodhound/cmd/api/src/model/Test_validateGraphExtension","Test_validateGraphExtension"
"Test cases for TestSet","0","TestSet","","Fri Jul 10 19:22:29 UTC 2026","passed","Fri Jul 10 19:22:29 UTC 2026","","Go Test","github.com/specterops/bloodhound/packages/go/lab/internal/TestSet","TestSet"
"Test cases for TestQueries_GetEntityResults","0","TestQueries_GetEntityResults","","Fri Jul 10 19:22:06 UTC 2026","passed","Fri Jul 10 19:22:06 UTC 2026","","Go Test","github.com/specterops/bloodhound/cmd/api/src/queries/TestQueries_GetEntityResults","TestQueries_GetEntityResults"
"","725","sets exploreSearchTab param to cypher when the user clicks the `cypher` tab","ExploreSearch sets searchType on tab changing","Fri Jul 10 19:29:29 UTC 2026","passed","Fri Jul 10 19:29:30 UTC 2026","","","",""
"","59","calls openSAMLProviderDialog when create provider button is clicked","CreateMenu","Fri Jul 10 19:25:18 UTC 2026","passed","Fri Jul 10 19:25:18 UTC 2026","","oidc_support feature flag disabled","",""
"","4","returns default empty labels and relationshipTypes when called with no arguments","graphSchema","Fri Jul 10 19:28:12 UTC 2026","passed","Fri Jul 10 19:28:12 UTC 2026","","","",""
"Test cases for TestDomainSelectors_GetFilterCriteria_InvalidFilterColumn","0","TestDomainSelectors_GetFilterCriteria_InvalidFilterColumn","","Fri Jul 10 19:22:04 UTC 2026","passed","Fri Jul 10 19:22:04 UTC 2026","","Go Test","github.com/specterops/bloodhound/cmd/api/src/model/TestDomainSelectors_GetFilterCriteria_InvalidFilterColumn","TestDomainSelectors_GetFilterCriteria_InvalidFilterColumn"
"","0","fails for password without uppercase letters","testPassword","Fri Jul 10 19:28:47 UTC 2026","passed","Fri Jul 10 19:28:47 UTC 2026","","","",""
"Test cases for TestManagementResource_EnrollMFA","3631","TestManagementResource_EnrollMFA","","Fri Jul 10 19:22:28 UTC 2026","passed","Fri Jul 10 19:22:31 UTC 2026","","Go Test","github.com/specterops/bloodhound/cmd/api/src/api/v2/auth/TestManagementResource_EnrollMFA","TestManagementResource_EnrollMFA"
"","250","displays the label for each result","SearchCurrentNodes","Fri Jul 10 19:26:37 UTC 2026","passed","Fri Jul 10 19:26:37 UTC 2026","","","",""
"Test cases for TestBoolValueOrZero","0","TestBoolValueOrZero","","Fri Jul 10 19:22:03 UTC 2026","passed","Fri Jul 10 19:22:03 UTC 2026","","Go Test","github.com/specterops/bloodhound/cmd/api/src/database/types/null/TestBoolValueOrZero","TestBoolValueOrZero"
"","111","renders correctly","NodeIcon","Fri Jul 10 19:28:02 UTC 2026","passed","Fri Jul 10 19:28:02 UTC 2026","","","",""
"","79","does not render when ruleId is empty","Delete Selector Button rendering","Fri Jul 10 19:28:23 UTC 2026","passed","Fri Jul 10 19:28:23 UTC 2026","","","",""
"","67","enables pulling an ordered list of tags by position ascending","the useAssetGroupTags utilities","Fri Jul 10 19:25:01 UTC 2026","passed","Fri Jul 10 19:25:01 UTC 2026","","","",""
"","11","should not render a Field when the provided value is []","Field","Fri Jul 10 19:28:07 UTC 2026","passed","Fri Jul 10 19:28:07 UTC 2026","","","",""
"Test cases for TestHandlers_IsEnabled","0","TestHandlers_IsEnabled","","Fri Jul 10 19:22:52 UTC 2026","passed","Fri Jul 10 19:22:52 UTC 2026","","Go Test","github.com/specterops/bloodhound/server/featureflags/internal/handlers/TestHandlers_IsEnabled","TestHandlers_IsEnabled"
"Test cases for TestSortParseAndValidate_Errors","0","TestSortParseAndValidate_Errors","","Fri Jul 10 19:22:31 UTC 2026","passed","Fri Jul 10 19:22:31 UTC 2026","","Go Test","github.com/specterops/bloodhound/packages/go/params/TestSortParseAndValidate_Errors","TestSortParseAndValidate_Errors"
"Test cases for TestConvertAzureResourceGroupContributorToRels","0","TestConvertAzureResourceGroupContributorToRels","","Fri Jul 10 19:22:27 UTC 2026","passed","Fri Jul 10 19:22:27 UTC 2026","","Go Test","github.com/specterops/bloodhound/packages/go/ein/TestConvertAzureResourceGroupContributorToRels","TestConvertAzureResourceGroupContributorToRels"
"","178","displays a table of completed ingest logs","FileIngest","Fri Jul 10 19:27:04 UTC 2026","passed","Fri Jul 10 19:27:04 UTC 2026","","","",""
"","391","sets a primarySearch=id and searchType=node when secondarySearch is falsey","ContextMenu","Fri Jul 10 19:29:39 UTC 2026","passed","Fri Jul 10 19:29:39 UTC 2026","","","",""
"","233","should display ""Create Token"" button","UserTokenManagementDialog","Fri Jul 10 19:24:54 UTC 2026","passed","Fri Jul 10 19:24:54 UTC 2026","","","",""
"Test cases for TestCacheEntryDigester_DigestEndpoint_DefaultObjectID","0","TestCacheEntryDigester_DigestEndpoint_DefaultObjectID","","Fri Jul 10 19:22:09 UTC 2026","passed","Fri Jul 10 19:22:09 UTC 2026","","Go Test","github.com/specterops/bloodhound/cmd/api/src/services/graphify/endpoint/TestCacheEntryDigester_DigestEndpoint_DefaultObjectID","TestCacheEntryDigester_DigestEndpoint_DefaultObjectID"
"","51","should display a message","CypherSearchMessage","Fri Jul 10 19:28:59 UTC 2026","passed","Fri Jul 10 19:28:59 UTC 2026","","","",""
"","11","returns active-directory environmentInfo when environmentAggregation param is active-directory","useAvailableEnvironments","Fri Jul 10 19:25:58 UTC 2026","passed","Fri Jul 10 19:25:58 UTC 2026","","useSelectedEnvironment","",""
"","66","should render oidc info provider","SSOProviderTable","Fri Jul 10 19:27:08 UTC 2026","passed","Fri Jul 10 19:27:08 UTC 2026","","","",""
"","0","returns the difference between the node and the position","getNodeOffset","Fri Jul 10 19:30:04 UTC 2026","passed","Fri Jul 10 19:30:04 UTC 2026","","","",""
"","65","passes data to testing component","SavedQueriesProvider","Fri Jul 10 19:28:25 UTC 2026","passed","Fri Jul 10 19:28:25 UTC 2026","","","",""
"Test cases for TestResources_DeleteSavedQuery","0","TestResources_DeleteSavedQuery","","Fri Jul 10 19:21:59 UTC 2026","passed","Fri Jul 10 19:21:59 UTC 2026","","Go Test","github.com/specterops/bloodhound/cmd/api/src/api/v2/TestResources_DeleteSavedQuery","TestResources_DeleteSavedQuery"
"","1","returns query config when searchType is composition and all required params are passed","useExploreGraph","Fri Jul 10 19:24:32 UTC 2026","passed","Fri Jul 10 19:24:32 UTC 2026","composition search queries","exploreGraphQueryFactory","",""
"","2","returns all environments when no filters are active","filterAndSearchEnvironments","Fri Jul 10 19:23:15 UTC 2026","passed","Fri Jul 10 19:23:15 UTC 2026","","with no filters applied","",""
"","0","The user has yet to type into the search (for OU and Domain searches that have hard coded types)","Getting the text for the disabled item display for a search when there are no results","Fri Jul 10 19:27:41 UTC 2026","passed","Fri Jul 10 19:27:41 UTC 2026","","Empty data states","",""
"","28","displays lastlogon cell as UNKNOWN when the value is 0","ExploreTableDataCell","Fri Jul 10 19:28:00 UTC 2026","passed","Fri Jul 10 19:28:00 UTC 2026","","","",""
"Test cases for TestUnmarshalInt64OverflowToInt64","0","TestUnmarshalInt64OverflowToInt64","","Fri Jul 10 19:22:03 UTC 2026","passed","Fri Jul 10 19:22:03 UTC 2026","","Go Test","github.com/specterops/bloodhound/cmd/api/src/database/types/null/TestUnmarshalInt64OverflowToInt64","TestUnmarshalInt64OverflowToInt64"
"","0","should compute the midpoint of a line segment","bezier","Fri Jul 10 19:29:46 UTC 2026","passed","Fri Jul 10 19:29:46 UTC 2026","","","",""
"","172","calls onSort when clicked","ColumnHeaders","Fri Jul 10 19:26:16 UTC 2026","passed","Fri Jul 10 19:26:16 UTC 2026","","SortableHeader","",""
"","346","sets a primarySearch=id and searchType=pathfinding when secondarySearch is truthy","ContextMenu","Fri Jul 10 19:29:39 UTC 2026","passed","Fri Jul 10 19:29:39 UTC 2026","","","",""
"Test cases for TestUnique","0","TestUnique","","Fri Jul 10 19:22:44 UTC 2026","passed","Fri Jul 10 19:22:44 UTC 2026","","Go Test","github.com/specterops/bloodhound/packages/go/slicesext/TestUnique","TestUnique"
"","340","filters unselected columns when typing in the filter input","ManageColumnsComboBox","Fri Jul 10 19:25:09 UTC 2026","passed","Fri Jul 10 19:25:09 UTC 2026","","","",""
"Test cases for TestManagementResource_ListUsers_DBError","2","TestManagementResource_ListUsers_DBError","","Fri Jul 10 19:22:05 UTC 2026","passed","Fri Jul 10 19:22:05 UTC 2026","","Go Test","github.com/specterops/bloodhound/cmd/api/src/api/v2/auth/TestManagementResource_ListUsers_DBError","TestManagementResource_ListUsers_DBError"
"","115","should render a button with the passed in display text","GraphButton","Fri Jul 10 19:28:53 UTC 2026","passed","Fri Jul 10 19:28:53 UTC 2026","","","",""
"","181","renders the form for editing an existing label","Tag Form","Fri Jul 10 19:22:50 UTC 2026","passed","Fri Jul 10 19:22:50 UTC 2026","","","",""
"Test cases for TestResources_DownloadCollectorChecksumByVersion","5","TestResources_DownloadCollectorChecksumByVersion","","Fri Jul 10 19:21:59 UTC 2026","passed","Fri Jul 10 19:21:59 UTC 2026","","Go Test","github.com/specterops/bloodhound/cmd/api/src/api/v2/TestResources_DownloadCollectorChecksumByVersion","TestResources_DownloadCollectorChecksumByVersion"
"Test cases for TestResources_DeleteExtension","71","TestResources_DeleteExtension","","Fri Jul 10 19:21:59 UTC 2026","passed","Fri Jul 10 19:21:59 UTC 2026","","Go Test","github.com/specterops/bloodhound/cmd/api/src/api/v2/TestResources_DeleteExtension","TestResources_DeleteExtension"
"","174","renders the form for creating a new label","Tag Form","Fri Jul 10 19:22:49 UTC 2026","passed","Fri Jul 10 19:22:49 UTC 2026","","","",""
"","369","displays expected results when searching by label","SearchCurrentNodes","Fri Jul 10 19:26:36 UTC 2026","passed","Fri Jul 10 19:26:36 UTC 2026","","","",""
"","321","should fire ""onClose"" once","UserTokenManagementDialog","Fri Jul 10 19:24:54 UTC 2026","passed","Fri Jul 10 19:24:54 UTC 2026","","when user clicks ""Close"" button","",""
"Test cases for TestManagementResource_ListAuthTokens_InvalidFilterPredicate","0","TestManagementResource_ListAuthTokens_InvalidFilterPredicate","","Fri Jul 10 19:22:28 UTC 2026","passed","Fri Jul 10 19:22:28 UTC 2026","","Go Test","github.com/specterops/bloodhound/cmd/api/src/api/v2/auth/TestManagementResource_ListAuthTokens_InvalidFilterPredicate","TestManagementResource_ListAuthTokens_InvalidFilterPredicate"
"Test cases for TestIngestControl_FetchRetainedIngestFiles","11","TestIngestControl_FetchRetainedIngestFiles","","Fri Jul 10 19:21:51 UTC 2026","passed","Fri Jul 10 19:21:51 UTC 2026","","Go Test","github.com/specterops/bloodhound/cmd/api/src/api/tools/TestIngestControl_FetchRetainedIngestFiles","TestIngestControl_FetchRetainedIngestFiles"
"","603","should accept passwords with standard special characters","CreateUserForm","Fri Jul 10 19:23:33 UTC 2026","passed","Fri Jul 10 19:23:34 UTC 2026","","","",""
"","740","should render","ExploreTable","Fri Jul 10 19:22:43 UTC 2026","passed","Fri Jul 10 19:22:44 UTC 2026","","","",""
"TestRegister_RoutesRequireAuthentication dispatches real unauthenticatedrequests through the wired router to verify that every registered graphdbroute is guarded by authentication middleware. If the route wireup everloses RequirePermissions(), this test will fail.","0","TestRegister_RoutesRequireAuthentication","","Fri Jul 10 19:22:55 UTC 2026","passed","Fri Jul 10 19:22:55 UTC 2026","","Go Test","github.com/specterops/bloodhound/server/graphdb/internal/routes/TestRegister_RoutesRequireAuthentication","TestRegister_RoutesRequireAuthentication"
"Test cases for TestManagementResource_ListAuthTokens_SortingError","0","TestManagementResource_ListAuthTokens_SortingError","","Fri Jul 10 19:22:28 UTC 2026","passed","Fri Jul 10 19:22:28 UTC 2026","","Go Test","github.com/specterops/bloodhound/cmd/api/src/api/v2/auth/TestManagementResource_ListAuthTokens_SortingError","TestManagementResource_ListAuthTokens_SortingError"
"Test cases for TestResources_ListADEntityControllables","1","TestResources_ListADEntityControllables","","Fri Jul 10 19:21:59 UTC 2026","passed","Fri Jul 10 19:21:59 UTC 2026","","Go Test","github.com/specterops/bloodhound/cmd/api/src/api/v2/TestResources_ListADEntityControllables","TestResources_ListADEntityControllables"
"","71","calls onSort when clicked with a tooltip","ColumnHeaders","Fri Jul 10 19:26:17 UTC 2026","passed","Fri Jul 10 19:26:17 UTC 2026","","SortableHeader with Tooltip","",""
"Test cases for TestOrphanFileSweeper_IsExcludedStoragePath","27","TestOrphanFileSweeper_IsExcludedStoragePath","","Fri Jul 10 19:22:01 UTC 2026","passed","Fri Jul 10 19:22:01 UTC 2026","","Go Test","github.com/specterops/bloodhound/cmd/api/src/daemons/datapipe/TestOrphanFileSweeper_IsExcludedStoragePath","TestOrphanFileSweeper_IsExcludedStoragePath"
"Test cases for TestAnalysisStepsScan","10","TestAnalysisStepsScan","","Fri Jul 10 19:22:04 UTC 2026","passed","Fri Jul 10 19:22:04 UTC 2026","","Go Test","github.com/specterops/bloodhound/cmd/api/src/model/TestAnalysisStepsScan","TestAnalysisStepsScan"
"Test cases for TestGetADDataQualityStats_Failure","3","TestGetADDataQualityStats_Failure","","Fri Jul 10 19:21:59 UTC 2026","passed","Fri Jul 10 19:21:59 UTC 2026","","Go Test","github.com/specterops/bloodhound/cmd/api/src/api/v2/TestGetADDataQualityStats_Failure","TestGetADDataQualityStats_Failure"
"","19","disables useAvailableEnvironment and does not attempt calling handleInitialEnvironment if queryOptions.enabled","useInitialEnvironment","Fri Jul 10 19:27:33 UTC 2026","passed","Fri Jul 10 19:27:33 UTC 2026","","","",""
"Test cases for TestResources_ListADDomainContainedGroups","0","TestResources_ListADDomainContainedGroups","","Fri Jul 10 19:21:59 UTC 2026","passed","Fri Jul 10 19:21:59 UTC 2026","","Go Test","github.com/specterops/bloodhound/cmd/api/src/api/v2/TestResources_ListADDomainContainedGroups","TestResources_ListADDomainContainedGroups"
